,Rumour,Year,Outlet,Clubs,Player,League,Player Link,Position,Age,Country,Join,Market Value,Club,Interested_clubs,Outcome
0,"PSG are to make renewed attempts to sign Manchester United and France midfielder Paul Pogba, 28",2020,Le Parisien - in French,"['Paris Saint-Germain', 'Manchester United']",Paul Pogba,Premier League,https://www.transfermarkt.co.uk/paul-pogba/profil/spieler/122153,Central Midfield,28.0,France,2152.0,60.0,Manchester United,['Paris Saint-Germain'],False
1,"Arsenal will make another attempt to sign 22-year-old Lyon and France midfielder Houssem Aouar and are preparing a PS100,000-a-week contract offer",2020,Sun,"['Arsenal', 'Lyon']",Houssem Aouar,Ligue 1,https://www.transfermarkt.co.uk/houssem-aouar/profil/spieler/395693,Central Midfield,23.0,Algeria,1826.0,42.0, Lyon,['Arsenal'],False
2,"Sergio Ramos is a target for Manchester United, PSG and Sevilla after the Spain centre-back, 35, left Real Madrid",2020,90min,"['Manchester United', 'Paris Saint-Germain', 'Sevilla', 'Real Madrid']",Sergio Ramos,LaLiga,https://www.transfermarkt.co.uk/sergio-ramos/profil/spieler/25557,Centre-Back,35.0,Spain,6148.0,10.0,Real Madrid,"['Manchester United', 'Paris Saint-Germain', 'Sevilla']",True
3,"Real Madrid and France defender Raphael Varane, 28, has yet to decide on his future, amid links to Manchester United and Chelsea",2020,Goal,"['Real Madrid', 'Manchester United', 'Chelsea']",Raphael Varane,LaLiga,https://www.transfermarkt.co.uk/raphael-varane/profil/spieler/164770,Centre-Back,28.0,France,4018.0,70.0,Real Madrid,"['Manchester United', 'Chelsea']",True
4,"Manchester United are being deterred from signing Varane, as well as 30-year-old Atletico Madrid and England full-back Kieran Trippier, because the high prices being quoted by their clubs",2020,ESPN,"['Manchester United', 'Atletico Madrid']",Kieran Trippier,LaLiga,https://www.transfermarkt.co.uk/kieran-trippier/profil/spieler/95810,Right-Back,30.0,England,1080.0,20.0,Atletico de Madrid,['Manchester United'],False
5,"Chelsea have joined Arsenal in the race to sign Real Sociedad and Sweden striker Alexander Isak, 21",2020,"AS, via Express","['Chelsea', 'Arsenal', 'Real Sociedad']",Alexander Isak,LaLiga,https://www.transfermarkt.co.uk/alexander-isak/profil/spieler/349066,Centre-Forward,21.0,Sweden,1096.0,40.0,Real Sociedad,"['Chelsea', 'Arsenal']",False
6,Juventus' 30-year-old Wales midfielder Aaron Ramsey could return to Arsenal who are struggling to attract elite talent and may turn to their former player,2020,Eurosport,"['Juventus', 'Arsenal']",Aaron Ramsey,Serie A,https://www.transfermarkt.co.uk/aaron-ramsey/profil/spieler/50057,Central Midfield,30.0,Wales,1096.0,14.0,Juventus ,['Arsenal'],False
7,"Liverpool are interested in signing Sassuolo and Italy winger Domenico Berardi, 26",2020,"Gazzetta dello Sport, via Express","['Liverpool', 'Sassuolo']",Domenico Berardi,Serie A,https://www.transfermarkt.co.uk/domenico-berardi/profil/spieler/177843,Right Winger,26.0,Italy,2557.0,35.0,US Sassuolo,['Liverpool'],False
8,"Arsenal's French midfielder Matteo Guendouzi, who spent last season on loan at Hertha Berlin, has agreed personal terms with Marseille, who are now discussing a fee for the 22-year-old with the Gunners",2020,Fabrizio Romano via Sun,"['Arsenal', 'Hertha', 'Marseille']",Matteo Guendouzi,Bundesliga,https://www.transfermarkt.co.uk/matteo-guendouzi/profil/spieler/465830,Central Midfield,22.0,France,634.0,20.0,Hertha,"['Arsenal', 'Marseille']",True
9,"West Ham would have to hand England midfielder Jesse Lingard, 28, a big pay rise to lure him on a permanent deal from Manchester United",2020,Football Insider,"['West Ham', 'Manchester United']",Jesse Lingard,Premier League,https://www.transfermarkt.co.uk/jesse-lingard/profil/spieler/141660,Attacking Midfield,28.0,England,2922.0,22.0,Manchester United,['West Ham'],False
10,"Watford are lining up a move for Arsenal's England defender Ainsley Maitland-Niles, 28",2020,Mirror,"['Watford', 'Arsenal']",Ainsley Maitland-Niles,Premier League,https://www.transfermarkt.co.uk/ainsley-maitland-niles/profil/spieler/285845,Right Midfield,23.0,England,1826.0,16.0,Arsenal ,['Watford'],False
11,Wolves have made an approach for Sporting Lisbon's 25-year-old Portugal midfielder Joao Palhinha,2020,Football Insider,"['Wolves', 'Sporting']",Joao Palhinha,Liga Portugal,https://www.transfermarkt.co.uk/joao-palhinha/profil/spieler/257455,Defensive Midfield,25.0,Portugal,2191.0,18.0,Sporting CP,['Wolves'],False
12,"Lazio's long-serving Romanian defender Stefan Radu, 34, has reached an agreement with the club to extend his contract having previously looked set to join Inter Milan on a free transfer",2020,Goal - in Italian,"['Lazio', 'Inter Milan']",Stefan Radu,Serie A,https://www.transfermarkt.co.uk/stefan-radu/profil/spieler/44420,Left-Back,34.0,Romania,5113.0,2.0,SS Lazio,['Inter Milan'],False
13,"Manchester City will make a take-it-or-leave-it offer to Tottenham Hotspur of PS100m for England striker Harry Kane, 27",2020,Daily Star on Sunday,"['Manchester City', 'Tottenham']",Harry Kane,Premier League,https://www.transfermarkt.co.uk/harry-kane/profil/spieler/132098,Centre-Forward,27.0,England,4199.0,120.0,Tottenham Hotspur,['Manchester City'],False
14,"Manchester United have made a new bid of more than PS75m for Borussia Dortmund and England winger Jadon Sancho, 21, after their initial offer of PS67m with add-ons was rejected by the German club",2020,Mail on Sunday,"['Manchester United', 'Dortmund']",Jadon Sancho,Bundesliga,https://www.transfermarkt.co.uk/jadon-sancho/profil/spieler/401173,Left Winger,21.0,England,1765.0,100.0,Borussia Dortmund,['Manchester United'],True
15,"Real Madrid's big summer signing could be the return of Colombia playmaker James Rodriguez, 29, from Everton",2020,Sport - in Spanish,"['Real Madrid', 'Everton']",James Rodriguez,Premier League,https://www.transfermarkt.co.uk/james-rodriguez/profil/spieler/88103,Attacking Midfield,29.0,Colombia,662.0,28.0,Everton ,['Real Madrid'],False
16,"Paris St-Germain have joined Manchester United in hoping to sign England full-back Kieran Trippier, 30, from Atletico Madrid",2020,France Football via Mundo Deportivo,"['Paris St-Germain', 'Manchester United', 'Atletico Madrid']",Kieran Trippier,LaLiga,https://www.transfermarkt.co.uk/kieran-trippier/profil/spieler/95810,Right-Back,30.0,England,1080.0,20.0,Atletico de Madrid,"['Paris St-Germain', 'Manchester United']",False
17,"Scotland right-back Stephen O'Donnell, 29, has an exit clause in his Motherwell contract that has alerted several English Championship clubs, including Birmingham City, Derby County, Blackpool, Blackburn Rovers and Barnsley",2020,Mail on Sunday,"['Motherwell', 'Birmingham', 'Blackpool', 'Blackburn', 'Barnsley']",Stephen O'Donnell,Scottish Premiership,https://www.transfermarkt.co.uk/stephen-odonnell/profil/spieler/186337,Right-Back,29.0,Scotland,687.0,0.9,Motherwell ,"['Birmingham', 'Blackpool', 'Blackburn', 'Barnsley']",False
18,"Portugal and Wolves goalkeeper Rui Patricio, 33, has reached an agreement to join Roma",2020,Sky Sports - in Italian,"['Wolves', 'Roma']",Rui Patricio,Premier League,https://www.transfermarkt.co.uk/rui-patricio/profil/spieler/45026,Goalkeeper,33.0,Portugal,1461.0,10.0,Wolves,['Roma'],True
19,"Borussia Dortmund and Real Sociedad are working on an agreement to waive the buyback clause in Alexander Isak's contract, so that the Sweden striker, 21, can sign a new deal with the Spanish club",2020,Sport1 - in German,"['Dortmund', 'Real Sociedad']",Alexander Isak,LaLiga,https://www.transfermarkt.co.uk/alexander-isak/profil/spieler/349066,Centre-Forward,21.0,Sweden,1096.0,40.0,Real Sociedad,['Dortmund'],False
20,Bayern Munich are interested in PSV Eindhoven and Netherlands full-back Denzel Dumfries - but the 25-year-old could prove too expensive,2020,Sky Sports - in German,"['Bayern Munich', 'Eindhoven']",Denzel Dumfries,Eredivisie,https://www.transfermarkt.co.uk/denzel-dumfries/profil/spieler/321528,Right Midfield,25.0,Netherlands,1461.0,16.0,PSV Eindhoven,['Bayern Munich'],False
21,Torino are interested in a loan deal for Real Madrid's 20-year-old Spanish midfielder Marvin Park,2020,Mundo Deportivo - in Spanish,"['Torino', 'Real Madrid']",Marvin Park,LaLiga,https://www.transfermarkt.co.uk/marvin-park/profil/spieler/603940,Right Winger,20.0,Spain,,0.5,Real Madrid,['Torino'],False
22,West Brom have made contact with former Everton boss Marco Silva as a back-up plan if talks prove to be unsuccessful with Barnsley manager Valerien Ismael,2020,Football Insider,"['West Brom', 'Everton', 'Barnsley']",Ismael,,,,,,,,,"['West Brom', 'Everton', 'Barnsley']",False
23,"Manchester City have made a PS100m bid for England striker Harry Kane, though Tottenham are expected to reject the offer as they do not want to sell the 27-year-old this summer",2020,Sky Sports,"['Manchester City', 'Tottenham']",Harry Kane,Premier League,https://www.transfermarkt.co.uk/harry-kane/profil/spieler/132098,Centre-Forward,27.0,England,4199.0,120.0,Tottenham Hotspur,['Manchester City'],False
24,"Borussia Dortmund have handed Manchester United a take-it-or-leave-it asking price of PS77m plus add-ons for England winger Jadon Sancho, 21",2020,Talksport,"['Dortmund', 'Manchester United']",Jadon Sancho,Bundesliga,https://www.transfermarkt.co.uk/jadon-sancho/profil/spieler/401173,Left Winger,21.0,England,1765.0,100.0,Borussia Dortmund,['Manchester United'],True
25,"Paris St-Germain have made contact with Real Madrid over a potential deal for French defender Raphael Varane, 28",2020,Foot Mercato - in French,"['Paris St-Germain', 'Real Madrid']",Raphael Varane,LaLiga,https://www.transfermarkt.co.uk/raphael-varane/profil/spieler/164770,Centre-Back,28.0,France,4018.0,70.0,Real Madrid,['Paris St-Germain'],False
26,"Jose Mourinho wants to bring former Real Madrid and Spain centre-back Sergio Ramos, 35, to Roma",2020,Calciomercato - in Italian,"['Real Madrid', 'Roma']",Sergio Ramos,LaLiga,https://www.transfermarkt.co.uk/sergio-ramos/profil/spieler/25557,Centre-Back,35.0,Spain,6148.0,10.0,Real Madrid,['Roma'],False
27,"Arsenal have opened talks with Eintracht Frankfurt over a move for Portugal striker Andre Silva, 25, who will be available for about PS34m this summer",2020,"Transfer Window Podcast, via Express","['Arsenal', 'Eintracht Frankfurt']",Andre Silva,Bundesliga,https://www.transfermarkt.co.uk/andre-silva/profil/spieler/198008,Centre-Forward,25.0,Portugal,659.0,45.0,Eintracht Frankfurt,['Arsenal'],False
28,"Arsenal are frontrunners to sign Real Betis and Argentina midfielder Guido Rodriguez, 27",2020,Marca - in Spanish,"['Arsenal', 'Betis']",Guido Rodriguez,LaLiga,https://www.transfermarkt.co.uk/guido-rodriguez/profil/spieler/342385,Defensive Midfield,27.0,Argentina,899.0,22.0,Real Betis Balompie,['Arsenal'],False
29,"Leicester want to sign Celtic and Scotland midfielder Ryan Christie, 26",2020,Mail,"['Leicester', 'Celtic']",Ryan Christie,Scottish Premiership,https://www.transfermarkt.co.uk/ryan-christie/profil/spieler/188077,Attacking Midfield,26.0,Scotland,2495.0,7.0,Celtic ,['Leicester'],False
30,"Turkey's 27-year-old midfielder Hakan Calhanoglu, who is out of contract at AC Milan this summer, has been given a deadline to decide his future, amid reports of interest from Arsenal",2020,"Football Italia, via Express","['AC Milan', 'Arsenal']",Hakan Calhanoglu,Serie A,https://www.transfermarkt.co.uk/hakan-calhanoglu/profil/spieler/126414,Central Midfield,27.0,Turkey,1824.0,35.0,AC Milan,['Arsenal'],False
31,"Eintracht Frankfurt are interested in Roma's Turkey winger Cengiz Under, 23, who spent last season on loan with Leicester City and could be available for 10m euros (PS8.6m)",2020,Calciomercato - in Italian,"['Eintracht Frankfurt', 'Roma', 'Leicester']",Cengiz Under,Premier League,https://www.transfermarkt.co.uk/cengiz-under/profil/spieler/341647,Right Winger,23.0,Turkey,649.0,18.0,Leicester City,"['Eintracht Frankfurt', 'Roma']",False
32,"Fiorentina are resigned to losing Nikola Milenkovic this summer as he has a year left on his contract and is not going to sign an extension. They will demand about PS15m for the Serbia defender, 23, who is rumoured to be wanted by Juventus and some Premier League clubs",2020,Calciomercato - in Italian,"['Fiorentina', 'Juventus']",Nikola Milenkovic,Serie A,https://www.transfermarkt.co.uk/nikola-milenkovic/profil/spieler/413507,Centre-Back,23.0,Serbia,1826.0,25.0,ACF Fiorentina,['Juventus'],False
33,"Barcelona have made contact over a potential move for Atalanta's Germany wing-back Robin Gosens, 26",2020,Sport1 - in German,"['Barcelona', 'Atalanta']",Robin Gosens,Serie A,https://www.transfermarkt.co.uk/robin-gosens/profil/spieler/273132,Left Midfield,26.0,Germany,1826.0,35.0,Atalanta BC,['Barcelona'],False
34,"West Brom have registered their interest in signing Stoke City's English midfielder Sam Clucas, 30",2020,Football Insider,"['West Brom', 'Stoke']",Sam Clucas,Championship,https://www.transfermarkt.co.uk/sam-clucas/profil/spieler/122223,Central Midfield,30.0,England,1422.0,2.0,Stoke City,['West Brom'],False
35,West Brom are also close to appointing Barnsley boss Valerien Ismael as their new manager after reaching an agreement in principle with the 45-year-old Frenchman,2020,Football Insider,"['West Brom', 'Barnsley']",Ismael,,,,,,,,,"['West Brom', 'Barnsley']",False
36,Manchester United are making progress in their efforts to sign 24-year-old Spain defender Pau Torres from Villarreal,2020,Manchester Evening News,"['Manchester United', 'Villarreal']",Pau Torres,LaLiga,https://www.transfermarkt.co.uk/pau-torres/profil/spieler/399776,Centre-Back,24.0,Spain,1461.0,50.0,Villarreal CF,['Manchester United'],False
37,Atletico Madrid are interested in signing Arsenal and Spain's 26-year-old right-back Hector Bellerin,2020,Marca - in Spanish,"['Atletico Madrid', 'Arsenal']",Hector Bellerin,Premier League,https://www.transfermarkt.co.uk/hector-bellerin/profil/spieler/191217,Right-Back,26.0,Spain,2922.0,25.0,Arsenal ,['Atletico Madrid'],False
38,"Rafael Benitez is edging closer to the Everton job after further talks over the weekend, despite some fans protesting against the former Liverpool manager's possible appointment",2020,Mirror,"['Everton', 'Liverpool']",Rafael,Campeonato Brasileiro Série A,https://www.transfermarkt.co.uk/rafael/profil/spieler/68097,Goalkeeper,32.0,Brazil,849.0,0.75,Clube Atletico Mineiro,"['Everton', 'Liverpool']",False
39,Atalanta are expected to hold off interest from both AC Milan and Roma in Italian midfielder Matteo Pessina and are set to offer the 24-year-old a contract extension,2020,Calciomercato - in Italian,"['Atalanta', 'AC Milan', 'Roma']",Matteo Pessina,Serie A,https://www.transfermarkt.co.uk/matteo-pessina/profil/spieler/332179,Central Midfield,24.0,Italy,1820.0,20.0,Atalanta BC,"['AC Milan', 'Roma']",False
40,"Leeds, Southampton, Aston Villa and Burnley would all be interested in Wales right-back Neco Williams with the 20-year-old keen to leave Liverpool",2020,Athletic,"['Leeds', 'Southampton', 'Aston Villa', 'Burnley', 'Liverpool']",Neco Williams,Premier League,https://www.transfermarkt.co.uk/neco-williams/profil/spieler/503680,Right-Back,20.0,Wales,912.0,8.0,Liverpool ,"['Leeds', 'Southampton', 'Aston Villa', 'Burnley']",False
41,"Wolves are interested in signing Leicester goalkeeper Danny Ward, 27, who has impressed playing for Wales at Euro 2020",2020,Football Insider,"['Wolves', 'Leicester']",Danny Ward,Premier League,https://www.transfermarkt.co.uk/danny-ward/profil/spieler/203026,Goalkeeper,28.0,Wales,1442.0,6.0,Leicester City,['Wolves'],False
42,"Bayern Munich have joined Everton, AC Milan and Inter Milan in the race to sign 25-year-old Dutch international full-back Denzel Dumfries from PSV Eindhoven",2020,Voetbal International - in Dutch,"['Bayern Munich', 'Everton', 'AC Milan', 'Inter Milan', 'Eindhoven']",Denzel Dumfries,Eredivisie,https://www.transfermarkt.co.uk/denzel-dumfries/profil/spieler/321528,Right Midfield,25.0,Netherlands,1461.0,16.0,PSV Eindhoven,"['Bayern Munich', 'Everton', 'AC Milan', 'Inter Milan']",True
43,"Lille's French midfielder Boubakary Soumare, 22, will have a medical at Leicester in the next 10 days before signing a five-year contract with the Premier League club",2020,La Voix des Sports - in French,"['Lille', 'Leicester']",Boubakary Soumare,Ligue 1,https://www.transfermarkt.co.uk/boubakary-soumare/profil/spieler/344605,Defensive Midfield,22.0,France,1815.0,28.0,LOSC Lille,['Leicester'],True
44,"Roma are in talks with Wolves over a deal for Portuguese goalkeeper Rui Patricio, with the Premier League club wanting between PS10m and PS13m for the 33-year-old",2020,Sky Sports,"['Roma', 'Wolves']",Rui Patricio,Premier League,https://www.transfermarkt.co.uk/rui-patricio/profil/spieler/45026,Goalkeeper,33.0,Portugal,1461.0,10.0,Wolves,['Roma'],True
45,"Southampton's England midfielder James Ward-Prowse, 26, is interested in joining Aston Villa this summer",2020,Football Insider,"['Southampton', 'Aston Villa']",James Ward-Prowse,Premier League,https://www.transfermarkt.co.uk/james-ward-prowse/profil/spieler/181579,Central Midfield,26.0,England,3652.0,30.0,Southampton ,['Aston Villa'],False
46,"Spain defender Sergio Ramos, 35, is assessing approaches he has received from Manchester City, Paris St-Germain and Bayern Munich before taking a decision on his future",2020,ESPN,"['Manchester City', 'Paris St-Germain', 'Bayern Munich']",Sergio Ramos,LaLiga,https://www.transfermarkt.co.uk/sergio-ramos/profil/spieler/25557,Centre-Back,35.0,Spain,6148.0,10.0,Real Madrid,"['Manchester City', 'Paris St-Germain', 'Bayern Munich']",True
47,"Tottenham Hotspur do not have an option to extend Wales forward Gareth Bale's loan with them for a second season and the 31-year-old is expected to return to parent club Real Madrid, where he has 12 months left on his contract",2020,Evening Standard,"['Tottenham', 'Real Madrid']",Gareth Bale,Premier League,https://www.transfermarkt.co.uk/gareth-bale/profil/spieler/39381,Right Winger,31.0,Wales,650.0,18.0,Tottenham Hotspur,['Real Madrid'],False
48,"Rennes say they have had no offer for French midfielder Eduardo Camavinga, despite the 18-year-old being linked to Manchester United and Paris St-Germain",2020,Metro,"['Rennes', 'Manchester United', 'Paris St-Germain']",Eduardo Camavinga,Ligue 1,https://www.transfermarkt.co.uk/eduardo-camavinga/profil/spieler/640428,Central Midfield,18.0,France,1277.0,55.0,Stade Rennais ,"['Rennes', 'Manchester United', 'Paris St-Germain']",False
49,"Roma are close to agreeing a deal to sign Portugal keeper Rui Patricio, 33, from Wolves",2020,Sky Sports,"['Roma', 'Wolves']",Rui Patricio,Premier League,https://www.transfermarkt.co.uk/rui-patricio/profil/spieler/45026,Goalkeeper,33.0,Portugal,1461.0,10.0,Wolves,['Roma'],True
50,"Arsenal are keen on Torino and Italy striker Andrea Belotti, but AC Milan, Fiorentina, Napoli and Roma are also looking at the 27-year-old",2020,"Tuttosport, via 90Min","['Arsenal', 'Torino', 'AC Milan', 'Fiorentina', 'Napoli', 'Roma']",Andrea Belotti,Serie A,https://www.transfermarkt.co.uk/andrea-belotti/profil/spieler/167727,Centre-Forward,27.0,Italy,2509.0,35.0,Torino ,"['Arsenal', 'AC Milan', 'Fiorentina', 'Napoli', 'Roma']",True
51,"Leicester City are one of a number of clubs interested in a summer move for 26-year-old Italy forward Domenico Berardi, who plays for Sassuolo",2020,"Gazzetta Dello Sport, via Leicester Mercury","['Leicester', 'Sassuolo']",Domenico Berardi,Serie A,https://www.transfermarkt.co.uk/domenico-berardi/profil/spieler/177843,Right Winger,26.0,Italy,2557.0,35.0,US Sassuolo,['Leicester'],False
52,"Norwich City are closing in on the loan signing of Scotland midfielder Billy Gilmour, 20, from Chelsea",2020,Sky Sports,"['Norwich', 'Chelsea']",Billy Gilmour,Premier League,https://www.transfermarkt.co.uk/billy-gilmour/profil/spieler/423744,Central Midfield,20.0,Scotland,871.0,10.0,Chelsea ,['Norwich'],True
53,"Liverpool could sign Porto's Brazilian attacking midfielder Otavio, 26, before Wednesday's deadline for his PS34m release clause",2020,Star,"['Liverpool', 'Porto']",Otavio,Liga Portugal,https://www.transfermarkt.co.uk/otavio/profil/spieler/231289,Attacking Midfield,26.0,Portugal,2860.0,24.0, Porto,['Liverpool'],False
54,Aston Villa and Norwich are both trying to sign 18-year-old English keeper Matthew Cox from League One side AFC Wimbledon,2020,Football Insider,"['Aston Villa', 'Norwich']",Matthew Cox,,,,,,,,,"['Aston Villa', 'Norwich']",False
55,Barnsley are in talks with TSV Hartberg boss Markus Schopp about the Austrian becoming their new manager following the departure of Valerien Ismael to West Bromwich Albion,2020,Sky Sports,"['Barnsley', 'Hartberg']",Ismael,,,,,,,,,"['Barnsley', 'Hartberg']",False
56,"Arsenal's deal for Brighton centre-back Ben White is all but complete and is expected to be finalised after Euro 2020, despite interest from Everton and Manchester City in the 23-year-old England defender",2020,Football London,"['Arsenal', 'Brighton', 'Everton', 'Manchester City']",Ben White,Premier League,https://www.transfermarkt.co.uk/ben-white/profil/spieler/335721,Right-Back,23.0,England,1461.0,28.0,Brighton & Hove Albion,"['Arsenal', 'Everton', 'Manchester City']",True
57,Arsenal are keeping tabs on former Real Madrid defender Sergio Ramos and have asked to be kept in the loop regarding the 35-year-old Spain centre-back's talks with Paris St-Germain,2020,Goal,"['Arsenal', 'Real Madrid', 'Paris St-Germain']",Sergio Ramos,LaLiga,https://www.transfermarkt.co.uk/sergio-ramos/profil/spieler/25557,Centre-Back,35.0,Spain,6148.0,10.0,Real Madrid,"['Arsenal', 'Paris St-Germain']",True
58,Manchester United are prepared to pay PS26m for Inter Milan's Marcelo Brozovic but could face competition from Barcelona for the 28-year-old Croatia midfielder,2020,"La Repubblica, via Star","['Manchester United', 'Inter Milan', 'Barcelona']",Marcelo Brozovic,Serie A,https://www.transfermarkt.co.uk/marcelo-brozovic/profil/spieler/156617,Defensive Midfield,28.0,Croatia,2191.0,40.0,Inter Milan,"['Manchester United', 'Barcelona']",False
59,"Arsenal are closely following Sheffield United's Sander Berge, 23, but the Gunners face competition from Liverpool, Lazio and Napoli for the Norway midfielder's signature",2020,Sun,"['Arsenal', 'Sheffield United', 'Liverpool', 'Lazio', 'Napoli']",Sander Berge,Premier League,https://www.transfermarkt.co.uk/sander-berge/profil/spieler/333014,Central Midfield,23.0,Norway,883.0,18.0,Sheffield United,"['Arsenal', 'Liverpool', 'Lazio', 'Napoli']",False
60,"Arsenal's 20-year-old defender William Saliba, who has been linked with Newcastle United and Lille, is set to join Marseille on loan",2020,Athletic - subscription required,"['Arsenal', 'Newcastle United', 'Lille', 'Marseille']",William Saliba,Premier League,https://www.transfermarkt.co.uk/william-saliba/profil/spieler/495666,Centre-Back,20.0,France,1072.0,18.0,Arsenal ,"['Newcastle United', 'Lille', 'Marseille']",True
61,"Arsenal are close to sealing a deal for Benfica's 21-year-old left-back Nuno Tavares, with the Portugal Under-21 defender flying to England to complete the move",2020,Sun,"['Arsenal', 'Benfica']",Nuno Tavares,Liga Portugal,https://www.transfermarkt.co.uk/nuno-tavares/profil/spieler/535955,Left-Back,21.0,Portugal,1096.0,7.0,SL Benfica,['Arsenal'],True
62,"Sassuolo are hoping to keep 26-year-old Italy winger Domenico Berardi, a player that club chief executive Giovanni Carnevali has described as a ""symbol"", amid interest from Liverpool and Tottenham",2020,"Radio 24, via Goal","['Sassuolo', 'Liverpool', 'Tottenham']",Domenico Berardi,Serie A,https://www.transfermarkt.co.uk/domenico-berardi/profil/spieler/177843,Right Winger,26.0,Italy,2557.0,35.0,US Sassuolo,"['Liverpool', 'Tottenham']",False
63,Tottenham have opened negotiations with Bologna over a deal for 22-year-old Japan defender Takehiro Tomiyasu,2020,Football London,"['Tottenham', 'Bologna']",Takehiro Tomiyasu,Serie A,https://www.transfermarkt.co.uk/takehiro-tomiyasu/profil/spieler/331560,Right-Back,22.0,Japan,1088.0,20.0,Bologna  1909,['Tottenham'],False
64,Manchester United have ended efforts to sign 24-year-old Barcelona winger Ousmane Dembele after the France forward was ruled out for up to four months with a leg injury,2020,Sport - in Spanish,"['Manchester United', 'Barcelona']",Ousmane Dembele,LaLiga,https://www.transfermarkt.co.uk/ousmane-dembele/profil/spieler/288230,Right Winger,24.0,France,1771.0,50.0, Barcelona,['Manchester United'],False
65,"Chelsea are poised to make a move for Wales goalkeeper Wayne Hennessey, 34, who is a free agent after his contract with Crystal Palace expired last month",2020,Express,"['Chelsea', 'Crystal Palace']",Wayne Hennessey,Premier League,https://www.transfermarkt.co.uk/wayne-hennessey/profil/spieler/45494,Goalkeeper,34.0,Wales,3073.0,1.0,Crystal Palace,['Chelsea'],False
66,"Arsenal have offered Reiss Nelson, 21, a new deal with the view of again sending him out on loan, with Olympiakos among the clubs interested in taking the England Under-21 forward, who previously had a spell at Hoffenheim",2020,Sun,"['Arsenal', 'Hoffenheim']",Reiss Nelson,Premier League,https://www.transfermarkt.co.uk/reiss-nelson/profil/spieler/340325,Right Winger,21.0,England,1096.0,9.0,Arsenal ,['Hoffenheim'],False
67,"Leeds United have recommenced their pursuit of England Under-21 winger Noni Madueke, 19, from PSV Eindhoven",2020,Football Insider,"['Leeds', 'Eindhoven']",Noni Madueke,Eredivisie,https://www.transfermarkt.co.uk/noni-madueke/profil/spieler/503987,Right Winger,19.0,England,699.0,16.0,PSV Eindhoven,['Leeds'],False
