,Rumour,Year,Outlet,Clubs,Player,League,Player Link,Position,Age,Country,Join,Market Value,Club,Interested_clubs,Outcome
6,"Leicester City's deal for Lille midfielder Boubakary Soumare, 22, could be completed sooner than anticipated after France Under-21s were knocked out of the European Championship",2022,Leicester Mercury,"['Leicester', 'Lille']",Boubakary Soumare,Premier League,https://www.transfermarkt.co.uk/boubakary-soumare/profil/spieler/344605,Defensive Midfield,23.0,France,364.0,25.0,Leicester City,['Lille'],False
7,"Brighton are preparing a new bid for Argentine winger Alan Velasco after Independiente rejected a PS6m offer for the 18-year-old, who has also attracted interest from Newcastle United",2022,Football Insider,"['Brighton', 'Newcastle United']",Alan,Campeonato Brasileiro Série A,https://www.transfermarkt.co.uk/alan/profil/spieler/73460,Centre-Forward,32.0,China,11.0,0.8,Fluminense Football Club,"['Brighton', 'Newcastle United']",False
8,"Manchester United are eyeing a move for Sporting Lisbon midfielder Pedro Goncalves, 22",2022,Record - via Star,"['Manchester United', 'Sporting']",Pedro Goncalves,Liga Portugal,https://www.transfermarkt.co.uk/pedro-goncalves/profil/spieler/426620,Left Winger,24.0,Portugal,682.0,30.0,Sporting CP,['Manchester United'],False
9,"Leeds United will explore alternative targets after being left frustrated by Stade Brest's asking price for French left-back Romain Perraud, 23",2022,Football Insider,"['Leeds', 'Brest']",Romain Perraud,Premier League,https://www.transfermarkt.co.uk/romain-perraud/profil/spieler/318523,Left-Back,24.0,France,364.0,8.0,Southampton ,"['Leeds', 'Brest']",False
10,Sunderland want to sign Wolves defender Dion Sanderson on a permanent deal after the 21-year-old Englishman impressed on loan last season,2022,Mail,"['Sunderland', 'Wolves']",Dion Sanderson,Championship,https://www.transfermarkt.co.uk/dion-sanderson/profil/spieler/495993,Centre-Back,22.0,England,157.0,0.6,Queens Park Rangers,"['Sunderland', 'Wolves']",False
11,"Tottenham are on the brink of appointing Antonio Conte as the club's new manager, with Fabio Paratici also set to join as sporting director after leaving Juventus last month",2022,Talksport,"['Tottenham', 'Juventus']",Fabio,Ligue 1,https://www.transfermarkt.co.uk/fabio/profil/spieler/61891,Right-Back,31.0,Brazil,1444.0,1.8, Nantes,"['Tottenham', 'Juventus']",False
12,"Barcelona are reportedly ready to sell Spanish midfielder Ilaix Moriba, 18, amid interest from Manchester United, Manchester City and Chelsea",2022,Mail,"['Barcelona', 'Manchester United', 'Manchester City', 'Chelsea']",Ilaix Moriba,Bundesliga,https://www.transfermarkt.co.uk/ilaix-moriba/profil/spieler/617074,Central Midfield,19.0,Guinea,304.0,9.0,RB Leipzig,"['Barcelona', 'Manchester United', 'Manchester City', 'Chelsea']",False
13,Liverpool lead the race to sign Raphinha from Leeds but Manchester United and Manchester City are also interested in the Brazilian winger,2022,Gianluigi Longari via Express,"['Liverpool', 'Leeds', 'Manchester United', 'Manchester City']",Raphinha,Premier League,https://www.transfermarkt.co.uk/raphinha/profil/spieler/411295,Right Winger,25.0,Brazil,634.0,45.0,Leeds United,"['Liverpool', 'Manchester United', 'Manchester City']",False
14,"Everton are considering a move for PSV Eindhoven's Netherlands right-back Denzel Dumfries, 25",2022,Voetbal International - in Dutch,"['Everton', 'Eindhoven']",Denzel Dumfries,Serie A,https://www.transfermarkt.co.uk/denzel-dumfries/profil/spieler/321528,Right Midfield,26.0,Netherlands,321.0,25.0,Inter Milan,"['Everton', 'Eindhoven']",False
15,"Norwich are set to make a bid of around PS10m for Celtic defender Kristoffer Ajer, with the 23-year-old Norway international about to enter the final year of his contract with the Scottish club",2022,Sun,"['Norwich', 'Celtic']",Kristoffer Ajer,Premier League,https://www.transfermarkt.co.uk/kristoffer-ajer/profil/spieler/328658,Centre-Back,24.0,Norway,345.0,18.0,Brentford ,"['Norwich', 'Celtic']",False
16,"Ajax have leapfrogged Manchester United in the race to sign Ghana winger Kamaldeen Sulemana, 19, from FC Nordsjaelland",2022,Football Insider,"['Ajax', 'Manchester United']",Kamaldeen Sulemana,Ligue 1,https://www.transfermarkt.co.uk/kamaldeen-sulemana/profil/spieler/746695,Left Winger,20.0,Ghana,350.0,18.0,Stade Rennais ,"['Ajax', 'Manchester United']",False
17,"France striker Olivier Giroud, 34, is set to choose AC Milan when his contract with Chelsea expires",2022,Gazzetta dello Sport - in Italian,"['AC Milan', 'Chelsea']",Olivier Giroud,Serie A,https://www.transfermarkt.co.uk/olivier-giroud/profil/spieler/82442,Centre-Forward,35.0,France,349.0,3.5,AC Milan,['Chelsea'],False
18,"Sead Kolasinac, 27, is still set to be sold by Arsenal after Schalke said they could not make the Bosnia left-back's loan move permanent this summer",2022,Football London,"['Arsenal', 'Schalke']",Sead Kolasinac,Premier League,https://www.transfermarkt.co.uk/sead-kolasinac/profil/spieler/94005,Left-Back,29.0,Bosnia-Herzegovina,1826.0,3.0,Arsenal ,['Schalke'],True
19,"Atletico Madrid are open to offers for Spanish midfielder Saul Niguez, 26, who has previously been linked with Manchester United",2022,Marca - in Spanish,"['Atletico Madrid', 'Manchester United']",Saul Niguez,LaLiga,https://www.transfermarkt.co.uk/saul-niguez/profil/spieler/148928,Central Midfield,27.0,Spain,3287.0,25.0,Atletico de Madrid,['Manchester United'],False
20,"Fiorentina are interested in signing French midfielder Tiemoue Bakayoko, 26, on loan from Chelsea this summer",2022,Fabrizio Romano,"['Fiorentina', 'Chelsea']",Tiemoue Bakayoko,Serie A,https://www.transfermarkt.co.uk/tiemoue-bakayoko/profil/spieler/182618,Defensive Midfield,27.0,France,305.0,10.0,AC Milan,"['Fiorentina', 'Chelsea']",True
21,"Douglas Luiz is expected to stay with Aston Villa as Manchester City are unlikely to trigger a buy-back clause for the Brazil midfielder, 23",2022,Express & Star,"['Aston Villa', 'Manchester City']",Douglas Luiz,Premier League,https://www.transfermarkt.co.uk/douglas-luiz/profil/spieler/447661,Central Midfield,24.0,Brazil,1072.0,38.0,Aston Villa,['Manchester City'],False
22,"Manchester United have been told it will cost them PS81.5m to sign England winger Jadon Sancho, 21, from Borussia Dortmund",2022,Mirror,"['Manchester United', 'Dortmund']",Jadon Sancho,Premier League,https://www.transfermarkt.co.uk/jadon-sancho/profil/spieler/401173,Left Winger,22.0,England,343.0,75.0,Manchester United,['Dortmund'],False
23,"West Ham are confident David Moyes will sign a new long-term contract after talks with the 58-year-old manager, who has been linked with a return to Everton",2022,Football Insider,"['West Ham', 'Everton']",David,Campeonato Brasileiro Série A,https://www.transfermarkt.co.uk/david/profil/spieler/373189,Left Winger,26.0,Brazil,158.0,2.0,Sport Club Internacional,"['West Ham', 'Everton']",False
24,"Atletico Madrid right-back Kieran Trippier, 30, has told England colleagues he is keen to join Manchester United this summer",2022,Mirror,"['Atletico Madrid', 'Manchester United']",Kieran Trippier,LaLiga,https://www.transfermarkt.co.uk/kieran-trippier/profil/spieler/95810,Right-Back,31.0,England,1080.0,15.0,Atletico de Madrid,['Manchester United'],False
25,"Barcelona are considering making an improved offer to Netherlands midfielder Georginio Wijnaldum, 30, who is set to leave Liverpool on a free transfer, after Paris St-Germain eclipsed Barca's initial offer",2022,Marca,"['Barcelona', 'Liverpool', 'Paris St-Germain']",Georginio Wijnaldum,Ligue 1,https://www.transfermarkt.co.uk/georginio-wijnaldum/profil/spieler/49499,Central Midfield,31.0,Netherlands,365.0,18.0,Paris Saint-Germain,"['Barcelona', 'Liverpool']",False
26,"If Barcelona do not complete the signing of Wijnaldum and Netherlands forward Memphis Depay, 27, from Lyon next week, it could hold up deals to sell up to four players",2022,Sport,"['Barcelona', 'Lyon']",Memphis Depay,LaLiga,https://www.transfermarkt.co.uk/memphis-depay/profil/spieler/167850,Centre-Forward,28.0,Netherlands,365.0,35.0, Barcelona,['Lyon'],False
27,"Next week Barca will offer a long-term extension to Ilaix Moriba, the 18-year-old Spanish midfielder who has one year left on his current deal and has been linked with Manchester City and Manchester United",2022,Marca,"['Manchester City', 'Manchester United']",Ilaix Moriba,Bundesliga,https://www.transfermarkt.co.uk/ilaix-moriba/profil/spieler/617074,Central Midfield,19.0,Guinea,304.0,9.0,RB Leipzig,"['Manchester City', 'Manchester United']",False
28,"Arsenal's Swiss international Granit Xhaka, 28, remains Roma's top target in midfield",2022,Corriere dello Sport - in Italian,"['Arsenal', 'Roma']",Granit Xhaka,Premier League,https://www.transfermarkt.co.uk/granit-xhaka/profil/spieler/111455,Central Midfield,29.0,Switzerland,2191.0,20.0,Arsenal ,['Roma'],False
29,"Leeds United have been offered the chance to sign former loanee Eddie Nketiah this summer, with Arsenal wanting PS20m for the English forward, 22",2022,Football Insider,"['Leeds', 'Arsenal']",Eddie Nketiah,Premier League,https://www.transfermarkt.co.uk/eddie-nketiah/profil/spieler/340324,Centre-Forward,23.0,England,1277.0,16.0,Arsenal ,['Leeds'],False
30,"Atletico Madrid are expected to make a new offer for Udinese's Argentina midfielder Rodrigo de Paul, 27, who has also been linked with Liverpool and AC Milan",2022,Mundo Deportivo - in Italian,"['Atletico Madrid', 'Udinese', 'Liverpool', 'AC Milan']",Rodrigo de Paul,LaLiga,https://www.transfermarkt.co.uk/rodrigo-de-paul/profil/spieler/255901,Central Midfield,28.0,Argentina,354.0,40.0,Atletico de Madrid,"['Udinese', 'Liverpool', 'AC Milan']",False
31,"Leeds United and Brighton have joined Rangers in the race to sign Sparta Rotterdam's Dutch midfielder Abdou Harroui, 23",2022,Football Insider,"['Leeds', 'Brighton', 'Rangers', 'Sparta Rotterdam']",Abdou Harroui,Eredivisie,https://www.transfermarkt.co.uk/abdou-harroui/profil/spieler/416386,Central Midfield,24.0,Morocco,1461.0,3.0,Sparta Rotterdam,"['Leeds', 'Brighton', 'Rangers']",False
32,"Burnley and Norwich are among several Premier League clubs who have asked Liverpool about taking Wales right-back Neco Williams, 20, on loan next season",2022,Teamtalk,"['Burnley', 'Norwich', 'Liverpool']",Neco Williams,Premier League,https://www.transfermarkt.co.uk/neco-williams/profil/spieler/503680,Right-Back,21.0,Wales,912.0,8.0,Liverpool ,"['Burnley', 'Norwich']",False
33,"West Brom have told Brazilian midfielder Matheus Pereira, 25, he can leave the Championship club this summer, if they are offered at least PS15m. Aston Villa and Brighton are among those who have made enquiries",2022,Teamtalk,"['West Brom', 'Aston Villa', 'Brighton']",Matheus Pereira,Liga Portugal,https://www.transfermarkt.co.uk/matheus-pereira/profil/spieler/739438,Left-Back,21.0,Brazil,-29.0,0.4, Vizela,"['West Brom', 'Aston Villa', 'Brighton']",False
34,"Bournemouth boss Jonathan Woodgate is in danger of being sacked, with Fulham boss Scott Parker, 40, top of the Cherries' wanted list to replace him",2022,Sun,"['Bournemouth', 'Fulham']",Jonathan,Campeonato Brasileiro Série A,https://www.transfermarkt.co.uk/jonathan/profil/spieler/980980,Left-Back,19.0,Brazil,,0.0,Atletico Clube Goianiense,"['Bournemouth', 'Fulham']",False
35,"After missing out on Buendia, Arsenal's main target remains bringing Norway midfielder Martin Odegaard, 22, back from Real Madrid, either on a loan or permanent move",2022,Football London,"['Arsenal', 'Real Madrid']",Martin Odegaard,Premier League,https://www.transfermarkt.co.uk/martin-odegaard/profil/spieler/316264,Attacking Midfield,23.0,Norway,315.0,45.0,Arsenal ,['Real Madrid'],True
36,"Wolves are braced for an offer from Arsenal this week for Portugal midfielder Ruben Neves, 24",2022,Mail,"['Wolves', 'Arsenal']",Ruben Neves,Premier League,https://www.transfermarkt.co.uk/ruben-neves/profil/spieler/225161,Defensive Midfield,25.0,Portugal,1819.0,40.0,Wolves,['Arsenal'],False
37,"Arsenal are set to rival Manchester United for England and Atletico Madrid full-back Kieran Trippier, 30",2022,Metro,"['Arsenal', 'Manchester United', 'Atletico Madrid']",Kieran Trippier,LaLiga,https://www.transfermarkt.co.uk/kieran-trippier/profil/spieler/95810,Right-Back,31.0,England,1080.0,15.0,Atletico de Madrid,"['Arsenal', 'Manchester United']",False
38,"France striker Olivier Giroud, 34, could still join AC Milan, despite Chelsea announcing they had triggered a one-year contract extension last week",2022,Goal,"['AC Milan', 'Chelsea']",Olivier Giroud,Serie A,https://www.transfermarkt.co.uk/olivier-giroud/profil/spieler/82442,Centre-Forward,35.0,France,349.0,3.5,AC Milan,['Chelsea'],False
39,"Barcelona have decided not to make an increased offer to Georginio Wijnaldum, 30, after Paris St-Germain offered more than double the wages Barca did. The Netherlands midfielder, who is available on a free transfer from Liverpool, is now set to sign a three-year deal with PSG",2022,"Fabrizio Romano, Twitter","['Barcelona', 'Paris St-Germain', 'Liverpool', 'Paris Saint-Germain']",Georginio Wijnaldum,Ligue 1,https://www.transfermarkt.co.uk/georginio-wijnaldum/profil/spieler/49499,Central Midfield,31.0,Netherlands,365.0,18.0,Paris Saint-Germain,"['Barcelona', 'Liverpool']",False
40,"Juventus may try a similar move with another Barcelona target, Netherlands forward Memphis Depay, 27, who is set to leave Lyon on a free transfer",2022,Mundo Deportivo,"['Juventus', 'Barcelona', 'Lyon']",Memphis Depay,LaLiga,https://www.transfermarkt.co.uk/memphis-depay/profil/spieler/167850,Centre-Forward,28.0,Netherlands,365.0,35.0, Barcelona,"['Juventus', 'Lyon']",False
41,"Borussia Monchengladbach would listen to offers of 40m euros (PS34.3m) for Leicester City target Jonas Hofmann, with Tottenham, Chelsea and Atletico Madrid also said to be interested in the Germany winger, 28",2022,Leicester Mercury,"['Borussia Monchengladbach', 'Leicester', 'Tottenham', 'Chelsea', 'Atletico Madrid']",Jonas Hofmann,Bundesliga,https://www.transfermarkt.co.uk/jonas-hofmann/profil/spieler/7161,Right Winger,29.0,Germany,2373.0,13.0,Borussia Monchengladbach,"['Leicester', 'Tottenham', 'Chelsea', 'Atletico Madrid']",False
42,"Real Betis are in advanced talks with Paraguay defender Fabian Balbuena, 29, who is set to come out of contract at West Ham",2022,Mundo Deportivo - in Spanish,"['Betis', 'West Ham']",Fabian Balbuena,Campeonato Brasileiro Série A,https://www.transfermarkt.co.uk/fabian-balbuena/profil/spieler/285548,Centre-Back,30.0,Paraguay,-17.0,6.0,Sport Club Corinthians Paulista,"['Betis', 'West Ham']",False
43,"Tottenham will confirm the appointment of former Juventus transfer chief Fabio Paratici this week, even after the collapse of their attempts to bring in ex-Juve and Inter Milan manager Antonio Conte",2022,Mirror,"['Tottenham', 'Juventus', 'Inter Milan']",Fabio,Ligue 1,https://www.transfermarkt.co.uk/fabio/profil/spieler/61891,Right-Back,31.0,Brazil,1444.0,1.8, Nantes,"['Tottenham', 'Juventus', 'Inter Milan']",False
44,"Leicester City are plotting a move for Barcelona midfielder Philippe Coutinho, and while the Foxes are yet to make a firm approach for the 29-year-old, there is talk of a potential PS17m bid or possible loan switch for the Brazilian",2022,Mundo Deportivo - in Spanish,"['Leicester', 'Barcelona']",Philippe Coutinho,LaLiga,https://www.transfermarkt.co.uk/philippe-coutinho/profil/spieler/80444,Left Winger,30.0,Brazil,1635.0,20.0, Barcelona,['Leicester'],False
45,"Leeds United are interested in signing Lyon left-back Maxwel Cornet, but have baulked at the PS20m asking price for the 24-year-old Ivory Coast international",2022,Sun,"['Leeds', 'Lyon']",Maxwel Cornet,Ligue 1,https://www.transfermarkt.co.uk/maxwel-cornet/profil/spieler/234781,Left Winger,25.0,Cote d'Ivoire,2724.0,15.0, Lyon,['Leeds'],False
46,Real Madrid manager Carlo Ancelotti has asked club bosses to make a move for Chelsea's 25-year-old German striker Timo Werner,2022,"Fichajes, via Express","['Real Madrid', 'Chelsea']",Timo Werner,Premier League,https://www.transfermarkt.co.uk/timo-werner/profil/spieler/170527,Centre-Forward,26.0,Germany,730.0,35.0,Chelsea ,['Real Madrid'],False
47,"Liverpool lead the race to sign Juventus' Argentine defender Cristian Romero, who has previously been heavily linked with a move to Manchester United after impressing on loan at Atalanta",2022,Calciomercato - via Team Talk,"['Liverpool', 'Juventus', 'Manchester United', 'Atalanta']",Cristian Romero,Premier League,https://www.transfermarkt.co.uk/cristian-romero/profil/spieler/355915,Centre-Back,24.0,Argentina,-60.0,48.0,Tottenham Hotspur,"['Liverpool', 'Juventus', 'Manchester United', 'Atalanta']",True
48,"Southampton and West Ham are the latest Premier League clubs to be linked with Boavista forward Alberth Elis, with Brighton and Watford previously showing interest in the 25-year-old Honduras international",2022,A Bola - in Portuguese,"['Southampton', 'West Ham', 'Boavista', 'Brighton', 'Watford']",Alberth Elis,Ligue 1,https://www.transfermarkt.co.uk/alberth-elis/profil/spieler/281319,Right Winger,26.0,Honduras,0.0,6.5, Girondins Bordeaux,"['Southampton', 'West Ham', 'Boavista', 'Brighton', 'Watford']",True
49,"Arsenal are keen to sign French midfielder Nabil Fekir from Real Betis, but offers from the Gunners are well short of what the La Liga club want for the 27-year-old",2022,AS - in Spanish,"['Arsenal', 'Betis']",Nabil Fekir,LaLiga,https://www.transfermarkt.co.uk/nabil-fekir/profil/spieler/203496,Attacking Midfield,28.0,France,1074.0,40.0,Real Betis Balompie,['Arsenal'],False
50,"Crystal Palace are poised to table a PS15 million offer for Chelsea's 21-year-old English midfielder Conor Gallagher, who is keen to remain at Stamford Bridge after impressing while on loan at West Brom last season",2022,Sun,"['Crystal Palace', 'Chelsea', 'West Brom']",Conor Gallagher,Premier League,https://www.transfermarkt.co.uk/conor-gallagher/profil/spieler/488362,Central Midfield,22.0,England,336.0,25.0,Crystal Palace,"['Chelsea', 'West Brom']",True
51,"West Ham, Southampton and AC Milan are in contention to sign 24-year-old Dominican defender Junior Firpo from Barcelona, with the Catalan club inclined to sell to a Premier League side rather than take Milan up on a loan deal with an option to buy",2022,Mundo Deportivo - in Spanish,"['West Ham', 'Southampton', 'AC Milan', 'Barcelona']",Junior Firpo,Premier League,https://www.transfermarkt.co.uk/junior-firpo/profil/spieler/374139,Left-Back,25.0,Dominican Republic,360.0,12.0,Leeds United,"['West Ham', 'Southampton', 'AC Milan', 'Barcelona']",False
52,"England midfielder Jesse Lingard, 28, has told Manchester United manager Ole Gunnar Solskjaer that he wants to remain with the Red Devils after a successful loan spell at West Ham last season",2022,Sun,"['Manchester United', 'West Ham']",Jesse Lingard,Premier League,https://www.transfermarkt.co.uk/jesse-lingard/profil/spieler/141660,Attacking Midfield,29.0,England,2922.0,18.0,Manchester United,['West Ham'],False
53,Tottenham's 31-year-old French midfielder Moussa Sissoko is on the radar of Serie A side Napoli,2022,Sky Italia - via Team Talk,"['Tottenham', 'Napoli']",Moussa Sissoko,Premier League,https://www.transfermarkt.co.uk/moussa-sissoko/profil/spieler/46001,Central Midfield,32.0,France,2130.0,4.5,Tottenham Hotspur,['Napoli'],False
54,"Midfielder Bernardo Silva is looking to leave Manchester City, and both Barcelona and Atletico Madrid are keen to sign the 26-year-old Portuguese international",2022,Duncan Castles on Twitter,"['Manchester City', 'Barcelona', 'Atletico Madrid']",Bernardo Silva,Premier League,https://www.transfermarkt.co.uk/bernardo-silva/profil/spieler/241641,Attacking Midfield,27.0,Portugal,1826.0,80.0,Manchester City,"['Barcelona', 'Atletico Madrid']",False
55,Leeds United have been linked with Rangers' 28-year-old Croatian left-back Borna Barisic,2022,Football Insider,"['Leeds', 'Rangers']",Borna Barisic,Scottish Premiership,https://www.transfermarkt.co.uk/borna-barisic/profil/spieler/39125,Left-Back,29.0,Croatia,1424.0,6.0,Rangers ,['Leeds'],False
56,"Juventus' Romania defender Radu Dragusin remains a transfer target for Crystal Palace, who have already made an offer for the 19-year-old",2022,Calciomercato - in Italian,"['Juventus', 'Crystal Palace']",Radu Dragusin,Serie A,https://www.transfermarkt.co.uk/radu-dragusin/profil/spieler/568559,Centre-Back,20.0,Romania,304.0,3.5,UC Sampdoria,"['Juventus', 'Crystal Palace']",True
57,"Portugal forward Cristiano Ronaldo, 36, has once again refused to rule out a move away from Juventus before his contract ends next year. He has been linked with his former club Manchester United, with the Italian side hoping to cash in on the veteran player",2022,Express,"['Juventus', 'Manchester United']",Cristiano Ronaldo,Serie A,https://www.transfermarkt.co.uk/cristiano-ronaldo/profil/spieler/8198,Centre-Forward,37.0,Portugal,1452.0,30.0,Juventus ,['Manchester United'],True
58,"England winger Jadon Sancho expects to become a Manchester United player, despite Borussia Dortmund rejecting a PS67m bid for the 21-year-old. The Bundesliga side are holding out for PS77m with add-ons",2022,Manchester Evening News,"['Manchester United', 'Dortmund']",Jadon Sancho,Premier League,https://www.transfermarkt.co.uk/jadon-sancho/profil/spieler/401173,Left Winger,22.0,England,343.0,75.0,Manchester United,['Dortmund'],False
59,Chelsea are now favourites to sign England and Aston Villa midfielder Jack Grealish this summer as they look to beat both Manchester clubs to the 25-year-old's signature,2022,Fichajes via Mirror,"['Chelsea', 'Aston Villa']",Jack Grealish,Premier League,https://www.transfermarkt.co.uk/jack-grealish/profil/spieler/203460,Left Winger,26.0,England,330.0,70.0,Manchester City,"['Chelsea', 'Aston Villa']",False
60,Swiss midfielder Granit Xhaka's transfer from Arsenal to Jose Mourinho's Roma is not expected to be finalised any time soon because the two clubs have reached a 'stalemate' in negotiations for the 28-year-old,2022,Corriere dello Sport via Express,"['Arsenal', 'Roma']",Granit Xhaka,Premier League,https://www.transfermarkt.co.uk/granit-xhaka/profil/spieler/111455,Central Midfield,29.0,Switzerland,2191.0,20.0,Arsenal ,['Roma'],False
61,"Arsenal's Scotland left-back Kieran Tierney, 24, has been tipped as a potential Manchester City player by Neil Lennon, his former boss at Celtic",2022,Times - subscription needed,"['Arsenal', 'Manchester City', 'Celtic']",Kieran Tierney,Premier League,https://www.transfermarkt.co.uk/kieran-tierney/profil/spieler/300716,Left-Back,25.0,Scotland,1058.0,32.0,Arsenal ,"['Manchester City', 'Celtic']",False
62,"Real Madrid centre-back Raphael Varane is set to leave the Spanish giants, with both Manchester United and French side Paris Saint Germain interested. It appears the 28-year-old's preference is the Ligue 1 side, who would need to pay around 60 million euros (PS51.5m) for the Frenchman",2022,"El Confidencial, via Caught Offside","['Real Madrid', 'Manchester United']",Raphael Varane,Premier League,https://www.transfermarkt.co.uk/raphael-varane/profil/spieler/164770,Centre-Back,29.0,France,321.0,48.0,Manchester United,['Real Madrid'],False
63,"Leicester City's acquisition of French midfielder Boubakary Soumare could finally be completed this week. Wolves and Everton are also admirers of the 22-year-old, currently playing with Ligue 1 champions Lille",2022,Mail,"['Leicester', 'Wolves', 'Everton', 'Lille']",Boubakary Soumare,Premier League,https://www.transfermarkt.co.uk/boubakary-soumare/profil/spieler/344605,Defensive Midfield,23.0,France,364.0,25.0,Leicester City,"['Wolves', 'Everton', 'Lille']",False
64,Burnley defender James Tarkowski is hoping to secure a move to West Ham this summer. The 28-year-old England international featured 36 times last season as Burnley avoided relegation again,2022,Football Insider,"['Burnley', 'West Ham', 'Burnley']",James Tarkowski,Premier League,https://www.transfermarkt.co.uk/james-tarkowski/profil/spieler/173504,Centre-Back,29.0,England,2342.0,22.0,Burnley ,['West Ham'],False
65,"PSG are to make renewed attempts to sign Manchester United and France midfielder Paul Pogba, 28",2022,Le Parisien - in French,"['Paris Saint-Germain', 'Manchester United']",Paul Pogba,Premier League,https://www.transfermarkt.co.uk/paul-pogba/profil/spieler/122153,Central Midfield,29.0,France,2152.0,48.0,Manchester United,['Paris Saint-Germain'],False
66,"Arsenal will make another attempt to sign 22-year-old Lyon and France midfielder Houssem Aouar and are preparing a PS100,000-a-week contract offer",2022,Sun,"['Arsenal', 'Lyon']",Houssem Aouar,Ligue 1,https://www.transfermarkt.co.uk/houssem-aouar/profil/spieler/395693,Central Midfield,24.0,Algeria,1826.0,25.0, Lyon,['Arsenal'],False
67,"Sergio Ramos is a target for Manchester United, PSG and Sevilla after the Spain centre-back, 35, left Real Madrid",2022,90min,"['Manchester United', 'Paris Saint-Germain', 'Sevilla', 'Real Madrid']",Sergio Ramos,Ligue 1,https://www.transfermarkt.co.uk/sergio-ramos/profil/spieler/25557,Centre-Back,36.0,Spain,358.0,6.0,Paris Saint-Germain,"['Manchester United', 'Sevilla', 'Real Madrid']",False
68,"Real Madrid and France defender Raphael Varane, 28, has yet to decide on his future, amid links to Manchester United and Chelsea",2022,Goal,"['Real Madrid', 'Manchester United', 'Chelsea']",Raphael Varane,Premier League,https://www.transfermarkt.co.uk/raphael-varane/profil/spieler/164770,Centre-Back,29.0,France,321.0,48.0,Manchester United,"['Real Madrid', 'Chelsea']",False
