,Rumour,Year,Outlet,Clubs,Player,League,Player Link,Position,Age,Country,Join,Market Value,Club,Interested_clubs,Outcome
125,"Arsenal are closely following Sheffield United's Sander Berge, 23, but the Gunners face competition from Liverpool, Lazio and Napoli for the Norway midfielder's signature",2021,Sun,"['Arsenal', 'Sheffield United', 'Liverpool', 'Lazio', 'Napoli']",Sander Berge,Premier League,https://www.transfermarkt.co.uk/sander-berge/profil/spieler/333014,Central Midfield,23.0,Norway,883.0,18.0,Sheffield United,"['Arsenal', 'Liverpool', 'Lazio', 'Napoli']",False
126,"Arsenal's 20-year-old defender William Saliba, who has been linked with Newcastle United and Lille, is set to join Marseille on loan",2021,Athletic - subscription required,"['Arsenal', 'Newcastle United', 'Lille', 'Marseille']",William Saliba,Premier League,https://www.transfermarkt.co.uk/william-saliba/profil/spieler/495666,Centre-Back,20.0,France,1072.0,18.0,Arsenal ,"['Newcastle United', 'Lille', 'Marseille']",True
127,"Arsenal are close to sealing a deal for Benfica's 21-year-old left-back Nuno Tavares, with the Portugal Under-21 defender flying to England to complete the move",2021,Sun,"['Arsenal', 'Benfica']",Nuno Tavares,Liga Portugal,https://www.transfermarkt.co.uk/nuno-tavares/profil/spieler/535955,Left-Back,21.0,Portugal,1096.0,7.0,SL Benfica,['Arsenal'],True
128,"Sassuolo are hoping to keep 26-year-old Italy winger Domenico Berardi, a player that club chief executive Giovanni Carnevali has described as a ""symbol"", amid interest from Liverpool and Tottenham",2021,"Radio 24, via Goal","['Sassuolo', 'Liverpool', 'Tottenham']",Domenico Berardi,Serie A,https://www.transfermarkt.co.uk/domenico-berardi/profil/spieler/177843,Right Winger,26.0,Italy,2557.0,35.0,US Sassuolo,"['Liverpool', 'Tottenham']",False
129,Tottenham have opened negotiations with Bologna over a deal for 22-year-old Japan defender Takehiro Tomiyasu,2021,Football London,"['Tottenham', 'Bologna']",Takehiro Tomiyasu,Serie A,https://www.transfermarkt.co.uk/takehiro-tomiyasu/profil/spieler/331560,Right-Back,22.0,Japan,1088.0,20.0,Bologna  1909,['Tottenham'],False
130,Manchester United have ended efforts to sign 24-year-old Barcelona winger Ousmane Dembele after the France forward was ruled out for up to four months with a leg injury,2021,Sport - in Spanish,"['Manchester United', 'Barcelona']",Ousmane Dembele,LaLiga,https://www.transfermarkt.co.uk/ousmane-dembele/profil/spieler/288230,Right Winger,24.0,France,1771.0,50.0, Barcelona,['Manchester United'],False
131,"Chelsea are poised to make a move for Wales goalkeeper Wayne Hennessey, 34, who is a free agent after his contract with Crystal Palace expired last month",2021,Express,"['Chelsea', 'Crystal Palace']",Wayne Hennessey,Premier League,https://www.transfermarkt.co.uk/wayne-hennessey/profil/spieler/45494,Goalkeeper,34.0,Wales,3073.0,1.0,Crystal Palace,['Chelsea'],False
132,"Arsenal have offered Reiss Nelson, 21, a new deal with the view of again sending him out on loan, with Olympiakos among the clubs interested in taking the England Under-21 forward, who previously had a spell at Hoffenheim",2021,Sun,"['Arsenal', 'Hoffenheim']",Reiss Nelson,Premier League,https://www.transfermarkt.co.uk/reiss-nelson/profil/spieler/340325,Right Winger,21.0,England,1096.0,9.0,Arsenal ,['Hoffenheim'],False
133,"Leeds United have recommenced their pursuit of England Under-21 winger Noni Madueke, 19, from PSV Eindhoven",2021,Football Insider,"['Leeds', 'Eindhoven']",Noni Madueke,Eredivisie,https://www.transfermarkt.co.uk/noni-madueke/profil/spieler/503987,Right Winger,19.0,England,699.0,16.0,PSV Eindhoven,['Leeds'],False
134,"Leicester City have ended their pursuit of Celtic striker Odsonne Edouard, 23",2021,Leicester Mercury,"['Leicester', 'Celtic']",Odsonne Edouard,Scottish Premiership,https://www.transfermarkt.co.uk/odsonne-edouard/profil/spieler/344152,Centre-Forward,23.0,France,1461.0,17.0,Celtic ,['Leicester'],False
135,"Paris St-Germain have offered a contract to 34-year-old Argentina forward Lionel Messi, who is a free agent after his deal at Barcelona expired. However, the La Liga side remain hopeful of tying the six-time Ballon d'Or winner down to a new deal",2021,AS - in Spanish,"['Paris St-Germain', 'Barcelona']",Lionel Messi,LaLiga,https://www.transfermarkt.co.uk/lionel-messi/profil/spieler/28003,Right Winger,34.0,Argentina,6209.0,80.0, Barcelona,['Paris St-Germain'],True
136,"Manchester United are willing to let Donny van de Beek leave the club this summer amid interest from Real Madrid, who want to take the 24-year-old Dutch midfielder on loan",2021,Star,"['Manchester United', 'Real Madrid']",Donny van de Beek,Premier League,https://www.transfermarkt.co.uk/donny-van-de-beek/profil/spieler/288255,Central Midfield,24.0,Netherlands,667.0,30.0,Manchester United,['Real Madrid'],False
137,"Liverpool are weighing a move for Atletico Madrid midfielder Saul Niguez, 26, with the Spaniard keen on the idea of playing in the Premier League",2021,La Razon - in Spanish,"['Liverpool', 'Atletico Madrid']",Saul Niguez,LaLiga,https://www.transfermarkt.co.uk/saul-niguez/profil/spieler/148928,Central Midfield,26.0,Spain,3287.0,40.0,Atletico de Madrid,['Liverpool'],False
138,"Liverpool are also interested in Lille and Portugal midfielder Renato Sanches, 23, but could face competition from Arsenal were they to pursue the former Bayern Munich player",2021,Onze Mondial - in French,"['Liverpool', 'Lille', 'Arsenal', 'Bayern Munich']",Renato Sanches,Ligue 1,https://www.transfermarkt.co.uk/renato-sanches/profil/spieler/258027,Central Midfield,23.0,Portugal,1043.0,30.0,LOSC Lille,"['Liverpool', 'Arsenal', 'Bayern Munich']",False
139,"Juventus boss Massimiliano Allegri has informed the club of his desire to re-sign Paul Pogba from Manchester United. The 28-year-old Frenchman, whose contract at Old Trafford will expire in 2022, won two Serie A titles with Juve during Allegri's first stint in charge",2021,90 Min,"['Juventus', 'Manchester United']",Paul Pogba,Premier League,https://www.transfermarkt.co.uk/paul-pogba/profil/spieler/122153,Central Midfield,28.0,France,2152.0,60.0,Manchester United,['Juventus'],True
140,"However, Milan have also been offered Brazil attacker Philippe Coutinho by Barcelona, who are keen to remove the former Liverpool star from their wage bill",2021,Mundo Deportivo - in Spanish,"['Barcelona', 'Liverpool']",Philippe Coutinho,LaLiga,https://www.transfermarkt.co.uk/philippe-coutinho/profil/spieler/80444,Left Winger,29.0,Brazil,1635.0,30.0, Barcelona,['Liverpool'],False
141,"Norwegian midfielder Martin Odegaard, 22, has all but confirmed that he will not be returning to Arsenal next season after spending time on loan in London from Real Madrid",2021,Football London,"['Arsenal', 'Real Madrid']",Martin Odegaard,LaLiga,https://www.transfermarkt.co.uk/martin-odegaard/profil/spieler/316264,Attacking Midfield,22.0,Norway,2000.0,40.0,Real Madrid,['Arsenal'],True
142,Burnley manager Sean Dyche is making a bid to sign 31-year-old English winger Marc Albrighton from Leicester City,2021,Sun,"['Burnley', 'Leicester']",Marc Albrighton,Premier League,https://www.transfermarkt.co.uk/marc-albrighton/profil/spieler/61560,Right Midfield,31.0,England,2922.0,4.0,Leicester City,['Burnley'],False
143,Inter Milan have opened talks with Denzel Dumfries' agent in the hope of wrapping up a deal for the 25-year-old PSV Eindhoven and Netherlands wing-back,2021,Calciomercato via Football Italia,"['Inter Milan', 'Eindhoven']",Denzel Dumfries,Eredivisie,https://www.transfermarkt.co.uk/denzel-dumfries/profil/spieler/321528,Right Midfield,25.0,Netherlands,1461.0,16.0,PSV Eindhoven,['Inter Milan'],True
144,"Tottenham remain interested in Fiorentina striker Dusan Vlahovic, 21, but the Serbia international is focused on renewing his contract with the Serie A club after scoring 21 goals in 37 league appearances in 2020-21",2021,Corriere dello Sport via Sport Witness,"['Tottenham', 'Fiorentina']",Dusan Vlahovic,Serie A,https://www.transfermarkt.co.uk/dusan-vlahovic/profil/spieler/357498,Centre-Forward,21.0,Serbia,1461.0,40.0,ACF Fiorentina,['Tottenham'],False
145,"Real Sociedad have failed with a late attempt to sign Benfica's 21-year-old Portuguese left-back Nuno Tavares, who is close to signing for Arsenal",2021,Mail,"['Real Sociedad', 'Benfica', 'Arsenal']",Nuno Tavares,Liga Portugal,https://www.transfermarkt.co.uk/nuno-tavares/profil/spieler/535955,Left-Back,21.0,Portugal,1096.0,7.0,SL Benfica,"['Real Sociedad', 'Arsenal']",True
146,"Sheffield United manager Slavisa Jokanovic says he will try to convince 23-year-old Norway midfielder Sander Berge, who has been linked with Arsenal, to stay with the Blades",2021,Mirror,"['Sheffield United', 'Arsenal']",Sander Berge,Premier League,https://www.transfermarkt.co.uk/sander-berge/profil/spieler/333014,Central Midfield,23.0,Norway,883.0,18.0,Sheffield United,['Arsenal'],False
147,"Manchester City and England star Raheem Sterling is open to offers to leave his club. But manager Pep Guardiola wants the 26-year-old winger to stay at Etihad Stadium, despite interest from Real Madrid",2021,Athletic - subscription required,"['Manchester City', 'Real Madrid']",Raheem Sterling,Premier League,https://www.transfermarkt.co.uk/raheem-sterling/profil/spieler/134425,Left Winger,26.0,England,2544.0,90.0,Manchester City,['Real Madrid'],False
148,"Gareth Bale, 31, may retire from club football once his PS600,000-a-week deal with Real Madrid expires next summer. There is huge speculation about the Wales forward's future after he returned from his loan spell at Tottenham",2021,Mail,"['Real Madrid', 'Tottenham']",Gareth Bale,Premier League,https://www.transfermarkt.co.uk/gareth-bale/profil/spieler/39381,Right Winger,31.0,Wales,650.0,18.0,Tottenham Hotspur,['Real Madrid'],False
149,"Chelsea and Arsenal are both monitoring Bayer Leverkusen and Burkina Faso international Edmond Tapsoba. But the 22-year-old centre-back has told journalists there is ""nothing concrete, nothing official"" and that he will start the season with the German side",2021,Metro,"['Chelsea', 'Arsenal']",Edmond Tapsoba,Bundesliga,https://www.transfermarkt.co.uk/edmond-tapsoba/profil/spieler/564545,Centre-Back,22.0,Burkina Faso,882.0,40.0,Bayer 04 Leverkusen,"['Chelsea', 'Arsenal']",False
150,Aston Villa believe a deal can be done for Arsenal midfielder Emile Smith Rowe and will submit a third offer for 20-year-old Englishman,2021,Football Insider,"['Aston Villa', 'Arsenal']",Emile Smith Rowe,Premier League,https://www.transfermarkt.co.uk/emile-smith-rowe/profil/spieler/392765,Attacking Midfield,20.0,England,699.0,18.0,Arsenal ,['Aston Villa'],False
151,"Arsenal are still pursuing Brighton defender Ben White, 23, having submitted a PS50m bid for the England international. However, suggestions it had been accepted are reported as ""absolute rubbish""",2021,Brighton Argus,"['Arsenal', 'Brighton']",Ben White,Premier League,https://www.transfermarkt.co.uk/ben-white/profil/spieler/335721,Right-Back,23.0,England,1461.0,28.0,Brighton & Hove Albion,['Arsenal'],True
152,Southampton are confident of securing Manchester United defender Brandon Williams on loan for the forthcoming season. Saints were keen on the 20-year-old Englishman last summer but United were reluctant to let him leave following his breakthrough season,2021,Mail,"['Southampton', 'Manchester United']",Brandon Williams,Premier League,https://www.transfermarkt.co.uk/brandon-williams/profil/spieler/507700,Left-Back,20.0,England,1096.0,10.0,Manchester United,['Southampton'],False
153,Burnley have shown interest in free agent Wayne Hennessey. The 34-year-old Wales goalkeeper is also an option for Chelsea and Aston Villa after leaving Crystal Palace when his contract expired last month,2021,Mail,"['Burnley', 'Chelsea', 'Aston Villa', 'Crystal Palace']",Wayne Hennessey,Premier League,https://www.transfermarkt.co.uk/wayne-hennessey/profil/spieler/45494,Goalkeeper,34.0,Wales,3073.0,1.0,Crystal Palace,"['Burnley', 'Chelsea', 'Aston Villa']",True
154,"Arsenal have also made an offer for Lyon midfielder Houssem Aouar with the French club expected to demand around up to PS25m for the 23-year-old, who was linked with a move to the Gunners last year",2021,Le10 Sport - in French,"['Arsenal', 'Lyon']",Houssem Aouar,Ligue 1,https://www.transfermarkt.co.uk/houssem-aouar/profil/spieler/395693,Central Midfield,23.0,Algeria,1826.0,42.0, Lyon,['Arsenal'],False
155,"Liverpool are ready to rival Manchester City in the race to sign Napoli and Poland midfielder Piotr Zielinski, 27, who scored eight goals and notched 10 assists for the Serie A side last season",2021,Calciomercato - in Italian,"['Liverpool', 'Manchester City', 'Napoli']",Piotr Zielinski,Serie A,https://www.transfermarkt.co.uk/piotr-zielinski/profil/spieler/181136,Central Midfield,27.0,Poland,2157.0,50.0,SSC Napoli,"['Liverpool', 'Manchester City']",False
156,"Tottenham have stepped up their interest in Barcelona midfielder Miralem Pjanic. Several clubs, including the Bosnian's former side Juventus, are interested in the 31-year-old, who is keen to have his future resolved quickly",2021,Sport via Sport Witness,"['Tottenham', 'Barcelona', 'Juventus']",Miralem Pjanic,LaLiga,https://www.transfermarkt.co.uk/miralem-pjanic/profil/spieler/44162,Central Midfield,31.0,Bosnia-Herzegovina,668.0,20.0, Barcelona,"['Tottenham', 'Juventus']",False
157,"Real Madrid manager Carlo Ancelotti has told the club he would like to sign Brazil forward Richarlison, 24, from former club Everton and the La Liga side will look into whether a deal is possible",2021,ESPN,"['Real Madrid', 'Everton']",Richarlison,Premier League,https://www.transfermarkt.co.uk/richarlison/profil/spieler/378710,Centre-Forward,24.0,Brazil,1438.0,55.0,Everton ,['Real Madrid'],False
158,"Arsenal are interested in signing Lyon and France midfielder Houssem Aouar, 23, but would need to sell a midfielder first",2021,ESPN,"['Arsenal', 'Lyon']",Houssem Aouar,Ligue 1,https://www.transfermarkt.co.uk/houssem-aouar/profil/spieler/395693,Central Midfield,23.0,Algeria,1826.0,42.0, Lyon,['Arsenal'],False
159,"Everton will not let Italy striker Moise Kean, 21, leave on another loan deal this season after he spent 2020-21 at Paris St-Germain",2021,Liverpool Echo,"['Everton', 'Paris St-Germain']",Moise Kean,Premier League,https://www.transfermarkt.co.uk/moise-kean/profil/spieler/364135,Centre-Forward,21.0,Italy,1062.0,35.0,Everton ,['Paris St-Germain'],True
160,"Paris St-Germain appeared to accidentally confirm the signing of 35-year-old Spain centre-back Sergio Ramos, who has left Real Madrid after the end of his contract, by publishing an article on the club's website prior to the official announcement of the move, which is expected on Thursday",2021,Goal,"['Paris St-Germain', 'Real Madrid']",Sergio Ramos,LaLiga,https://www.transfermarkt.co.uk/sergio-ramos/profil/spieler/25557,Centre-Back,35.0,Spain,6148.0,10.0,Real Madrid,['Paris St-Germain'],True
161,Wolves have agreed to sell 22-year-old Portuguese defender Ruben Vinagre to Sporting Lisbon in an PS8.6m deal,2021,Football Insider,"['Wolves', 'Sporting']",Ruben Vinagre,Premier League,https://www.transfermarkt.co.uk/ruben-vinagre/profil/spieler/357158,Left-Back,22.0,Portugal,1461.0,5.0,Wolves,['Sporting'],True
162,"Tottenham are looking at Sassuolo defender Mert Muldur, with West Ham also said to be interested in the 22-year-old Turkey international",2021,Mail,"['Tottenham', 'Sassuolo', 'West Ham']",Mert Muldur,Serie A,https://www.transfermarkt.co.uk/mert-muldur/profil/spieler/353922,Right-Back,22.0,Turkey,1046.0,9.0,US Sassuolo,"['Tottenham', 'West Ham']",False
163,"Southampton are confident of signing English striker Adam Armstrong, 24, from Blackburn Rovers for a PS10m fee plus add-ons",2021,Football League World,"['Southampton', 'Blackburn']",Adam Armstrong,Championship,https://www.transfermarkt.co.uk/adam-armstrong/profil/spieler/250426,Centre-Forward,24.0,England,1425.0,18.0,Blackburn Rovers,['Southampton'],True
164,"Tottenham will let Republic of Ireland striker Troy Parrott, 19, spend another season out on loan after spells at Millwall and Ipswich Town in 2020-21",2021,Football London,"['Tottenham', 'Millwall']",Troy Parrott,Championship,https://www.transfermarkt.co.uk/troy-parrott/profil/spieler/552655,Centre-Forward,19.0,Ireland,699.0,3.6,Millwall ,['Tottenham'],False
165,"Watford are ready to sign 25-year-old Stoke and Nigeria midfielder Peter Etebo, who spent last season on loan at Galatasaray",2021,Sun,"['Watford', 'Stoke']",Peter Etebo,Süper Lig,https://www.transfermarkt.co.uk/peter-etebo/profil/spieler/409106,Central Midfield,25.0,Nigeria,660.0,3.2,Galatasaray,"['Watford', 'Stoke']",True
166,"Bayern Munich boss Julian Nagelsmann says 26-year-old Germany midfielder Leon Goretzka, who has been linked with Manchester United, is an ""important"" player for the club and he ""would be happy to work with him for many years""",2021,Goal,"['Bayern Munich', 'Manchester United']",Leon Goretzka,Bundesliga,https://www.transfermarkt.co.uk/leon-goretzka/profil/spieler/153084,Central Midfield,26.0,Germany,1461.0,70.0,Bayern Munich,['Manchester United'],False
167,"Liverpool have made an approach for Wolves and Spain winger Adama Traore, 25",2021,Football Insider,"['Liverpool', 'Wolves']",Adama Traore,Premier League,https://www.transfermarkt.co.uk/adama-traore/profil/spieler/204103,Right Winger,25.0,Spain,1423.0,30.0,Wolves,['Liverpool'],False
168,"Hector Bellerin, 26, wants to quit Arsenal and join Italian champions Inter Milan. The Spanish full-back was linked with a move away from the Emirates last term and Paris St-Germain then mentioned as the most likely destination",2021,FourFourTwo,"['Arsenal', 'Inter Milan', 'Paris St-Germain']",Hector Bellerin,Premier League,https://www.transfermarkt.co.uk/hector-bellerin/profil/spieler/191217,Right-Back,26.0,Spain,2922.0,25.0,Arsenal ,"['Inter Milan', 'Paris St-Germain']",False
169,Paris St-Germain believe they can land Paul Pogba for a cut-price PS50m as they plot a raid for the 28-year-old Manchester United and France midfielder,2021,Star,"['Paris St-Germain', 'Manchester United']",Paul Pogba,Premier League,https://www.transfermarkt.co.uk/paul-pogba/profil/spieler/122153,Central Midfield,28.0,France,2152.0,60.0,Manchester United,['Paris St-Germain'],False
170,"Chelsea's France striker Olivier Giroud, 34, is on the verge of signing a two-year contract with Italian outfit AC Milan",2021,Mail,"['Chelsea', 'AC Milan']",Olivier Giroud,Premier League,https://www.transfermarkt.co.uk/olivier-giroud/profil/spieler/82442,Centre-Forward,34.0,France,1612.0,4.0,Chelsea ,['AC Milan'],True
171,"Tottenham are considering a bid for highly-rated Wolfsburg defender Maxence Lacroix. The Frenchman, 21, joined the Bundesliga side from Sochaux last summer and has been likened to Rio Ferdinand",2021,The Boot Room,"['Tottenham', 'Wolfsburg']",Maxence Lacroix,Bundesliga,https://www.transfermarkt.co.uk/maxence-lacroix/profil/spieler/434224,Centre-Back,21.0,France,675.0,28.0,VfL Wolfsburg,['Tottenham'],False
172,Manchester United winger Tahith Chong is nearing a deal to join Birmingham on loan. The 21-year-old Dutchman has been out on loan in the past couple of years at Belgian outfit Club Brugge and German side Werder Bremen,2021,Telegraph,"['Manchester United', 'Birmingham', 'Club Brugge', 'Werder Bremen']",Tahith Chong,Bundesliga,https://www.transfermarkt.co.uk/tahith-chong/profil/spieler/344830,Right Winger,21.0,Netherlands,684.0,4.0,SV Werder Bremen,"['Manchester United', 'Birmingham', 'Club Brugge']",True
173,"Tottenham, Leeds and Leicester City target Mikkel Damsgaard is set to become a Premier League player next season with the Denmark star's agent in talks with a number of English clubs. Sampdoria president Massimo Ferrero said the forward, 21, has increased in value following impressive performances at the Euros",2021,HITC,"['Tottenham', 'Leeds', 'Leicester', 'Sampdoria']",Mikkel Damsgaard,Serie A,https://www.transfermarkt.co.uk/mikkel-damsgaard/profil/spieler/540941,Left Winger,20.0,Denmark,668.0,13.0,UC Sampdoria,"['Tottenham', 'Leeds', 'Leicester']",False
174,"Tottenham are frontrunners to sign Bologna and Japan defender Takehiro Tomiyasu, 22",2021,Football Insider,"['Tottenham', 'Bologna']",Takehiro Tomiyasu,Serie A,https://www.transfermarkt.co.uk/takehiro-tomiyasu/profil/spieler/331560,Right-Back,22.0,Japan,1088.0,20.0,Bologna  1909,['Tottenham'],False
175,"Liverpool boss Jurgen Klopp has told Anfield bosses the three players he wants this summer, including France winger Kingsley Coman. The 25-year-old Bayern Munich star could cost the Reds up to PS86m",2021,Mirror,"['Liverpool', 'Bayern Munich']",Kingsley Coman,Bundesliga,https://www.transfermarkt.co.uk/kingsley-coman/profil/spieler/243714,Left Winger,25.0,France,1826.0,65.0,Bayern Munich,['Liverpool'],False
176,"Leeds are trying to sign Lyon and Ivory Coast defender Maxwel Cornet, 24",2021,Olympique et Lyonnais,"['Leeds', 'Lyon']",Maxwel Cornet,Ligue 1,https://www.transfermarkt.co.uk/maxwel-cornet/profil/spieler/234781,Left Winger,24.0,Cote d'Ivoire,2724.0,12.0, Lyon,['Leeds'],False
177,"Manchester United are not working on a player swap deal to bring England striker Harry Kane, 27, to Old Trafford from Tottenham",2021,Sunday Express,"['Manchester United', 'Tottenham']",Harry Kane,Premier League,https://www.transfermarkt.co.uk/harry-kane/profil/spieler/132098,Centre-Forward,27.0,England,4199.0,120.0,Tottenham Hotspur,['Manchester United'],False
178,"Chelsea have contacted Rennes about a move for 18-year-old France midfielder Eduardo Camavinga, who is also wanted by Manchester United, Arsenal and Real Madrid but is said to prefer to stay in France with a potential transfer to Paris St-Germain",2021,Le Parisien - via Sun on Sunday,"['Chelsea', 'Rennes', 'Manchester United', 'Arsenal', 'Real Madrid', 'Paris St-Germain']",Eduardo Camavinga,Ligue 1,https://www.transfermarkt.co.uk/eduardo-camavinga/profil/spieler/640428,Central Midfield,18.0,France,1277.0,55.0,Stade Rennais ,"['Chelsea', 'Rennes', 'Manchester United', 'Arsenal', 'Real Madrid', 'Paris St-Germain']",True
179,"West Ham have moved to pole position in pursuit of Chelsea's 23-year-old striker Tammy Abraham, with Aston Villa previously favourites to sign the England international while Wolves and Borussia Dortmund have both also been linked with him",2021,Football Insider,"['West Ham', 'Chelsea', 'Aston Villa', 'Wolves', 'Dortmund']",Tammy Abraham,Premier League,https://www.transfermarkt.co.uk/tammy-abraham/profil/spieler/331726,Centre-Forward,23.0,England,1826.0,38.0,Chelsea ,"['West Ham', 'Aston Villa', 'Wolves', 'Dortmund']",False
180,"Burnley are working on a PS13m bid for Lyon's 24-year-old Ivory Coast defender Maxwel Cornet, who is also wanted by Hertha Berlin",2021,Sun on Sunday,"['Burnley', 'Lyon', 'Hertha']",Maxwel Cornet,Ligue 1,https://www.transfermarkt.co.uk/maxwel-cornet/profil/spieler/234781,Left Winger,24.0,Cote d'Ivoire,2724.0,12.0, Lyon,"['Burnley', 'Hertha']",True
181,"Tottenham could make it difficult for Real Madrid to sign France defender Jules Kounde from Sevilla, with Spurs willing to offer as much as PS51m for the 22-year-old which would be beyond what the Spanish club could spend",2021,Sport,"['Tottenham', 'Real Madrid', 'Sevilla']",Jules Kounde,LaLiga,https://www.transfermarkt.co.uk/jules-kounde/profil/spieler/411975,Centre-Back,22.0,France,1094.0,60.0,Sevilla ,"['Tottenham', 'Real Madrid']",False
182,"The completion of France striker Olivier Giroud's move from Chelsea to AC Milan in imminent, with the 34-year-old agreeing a two-year deal with the Italian club",2021,Le Parisien - in French,"['Chelsea', 'AC Milan']",Olivier Giroud,Premier League,https://www.transfermarkt.co.uk/olivier-giroud/profil/spieler/82442,Centre-Forward,34.0,France,1612.0,4.0,Chelsea ,['AC Milan'],True
183,"Arsenal's efforts to try sign Ajax goalkeeper Andre Onana, 25, have been dealt a blow as as the Cameroon international is said to prefer a move to French side Lyon over the Premier League side",2021,Football London,"['Arsenal', 'Ajax', 'Lyon']",Andre Onana,Eredivisie,https://www.transfermarkt.co.uk/andre-onana/profil/spieler/234509,Goalkeeper,25.0,Cameroon,2725.0,30.0,Ajax Amsterdam,"['Arsenal', 'Lyon']",False
184,Sampdoria are considering making a move for 26-year-old Scotland midfielder Ryan Christie from Celtic,2021,Record,"['Sampdoria', 'Celtic']",Ryan Christie,Scottish Premiership,https://www.transfermarkt.co.uk/ryan-christie/profil/spieler/188077,Attacking Midfield,26.0,Scotland,2495.0,7.0,Celtic ,['Sampdoria'],False
185,"Tottenham are confident they can offload 23-year-old defender Cameron Carter-Vickers, despite doubling their asking price to PS5m. Both Newcastle United and Celtic are interested in the USA international",2021,Football Insider,"['Tottenham', 'Newcastle United', 'Celtic']",Cameron Carter-Vickers,Premier League,https://www.transfermarkt.co.uk/cameron-carter-vickers/profil/spieler/341049,Centre-Back,23.0,United States,2191.0,2.0,Tottenham Hotspur,"['Newcastle United', 'Celtic']",False
186,"Arsenal's hopes of signing Ajax goalkeeper Andre Onana have been dealt a blow with the 25-year-old Cameroon international agreeing personal terms with the Lyon. The two clubs, however, are yet to reach an agreement",2021,Fabrizio Romano - via Sun,"['Arsenal', 'Ajax', 'Lyon']",Andre Onana,Eredivisie,https://www.transfermarkt.co.uk/andre-onana/profil/spieler/234509,Goalkeeper,25.0,Cameroon,2725.0,30.0,Ajax Amsterdam,"['Arsenal', 'Lyon']",False
187,"Arsenal have begun negotiations with Wolves about signing Portugal midfielder Ruben Neves, 24",2021,Record - in Portuguese,"['Arsenal', 'Wolves']",Ruben Neves,Premier League,https://www.transfermarkt.co.uk/ruben-neves/profil/spieler/225161,Defensive Midfield,24.0,Portugal,1819.0,45.0,Wolves,['Arsenal'],False
