,Rumour,Year,Outlet,Clubs,Player,League,Player Link,Position,Age,Country,Join,Market Value,Club,Interested_clubs,Outcome
470,"Bayern Munich's France full-back Benjamin Pavard, 26, would be willing to join Chelsea if they made a  offer",2022,Bild,"['Bayern Munich', 'Chelsea']",Benjamin Pavard,Bundesliga,https://www.transfermarkt.co.uk/benjamin-pavard/profil/spieler/353366,Right-Back,26.0,France,1096.0,30.0,Bayern Munich,['Chelsea'],False
471,"Chelsea's Germany forward Timo Werner, 26, has accepted a 50% pay cut to rejoin RB Leipzig - and a loan fee with a purchase clause is being discussed",2022,Bild - in German,"['Chelsea', 'RB Leipzig']",Timo Werner,Premier League,https://www.transfermarkt.co.uk/timo-werner/profil/spieler/170527,Centre-Forward,26.0,Germany,730.0,35.0,Chelsea ,['RB Leipzig'],True
472,"Juventus are also interested in signing France forward Anthony Martial from Manchester United on loan, but Red Devils boss Erik ten Hag is keen to keep the 26-year-old",2022,Calciomercato - in Italian,"['Juventus', 'Manchester United']",Anthony Martial,Premier League,https://www.transfermarkt.co.uk/anthony-martial/profil/spieler/182877,Centre-Forward,26.0,France,2495.0,16.0,Manchester United,['Juventus'],False
473,Manchester United met Fabian Ruiz's representatives over a potential deal for the 26-year-old Spain and Napoli midfielder,2022,"Calcio Napoli 24, via Sun","['Manchester United', 'Napoli']",Fabian Ruiz,Serie A,https://www.transfermarkt.co.uk/fabian-ruiz/profil/spieler/350219,Central Midfield,26.0,Spain,1457.0,55.0,SSC Napoli,['Manchester United'],False
474,Chelsea have made a first offer to Inter Milan for their 19-year-old Italian midfielder Cesare Casadei,2022,Gianluca di Marzio - in Italian,"['Chelsea', 'Inter Milan']",Cesare Casadei,Serie A,https://www.transfermarkt.co.uk/cesare-casadei/profil/spieler/622380,Central Midfield,19.0,Italy,,1.0,Inter Milan,['Chelsea'],False
475,"Rennes have agreed a deal with Tottenham to sign Wales defender Joe Rodon, 24, on a season-long loan",2022,90min,"['Rennes', 'Tottenham']",Joe Rodon,Premier League,https://www.transfermarkt.co.uk/joe-rodon/profil/spieler/297212,Centre-Back,24.0,Wales,623.0,8.0,Tottenham Hotspur,['Rennes'],False
476,"Barcelona president Joan Laporta says there is a ""strong possibility"" Manchester United target Frenkie de Jong will stay at the club and he will ""do my best"" to keep the Netherlands midfielder, 25",2022,CBS Sports,"['Barcelona', 'Manchester United']",Frenkie de Jong,LaLiga,https://www.transfermarkt.co.uk/frenkie-de-jong/profil/spieler/326330,Central Midfield,25.0,Netherlands,1096.0,60.0, Barcelona,['Manchester United'],False
477,"Newcastle are prepared to trigger Burnley winger Maxwel Cornet's PS17.5m release clause. The Ivory Coast forward, 25, has also been linked to Everton, Nottingham Forest and Chelsea",2022,Talksport,"['Newcastle', 'Burnley', 'Everton', 'Nottingham', 'Chelsea']",Maxwel Cornet,Ligue 1,https://www.transfermarkt.co.uk/maxwel-cornet/profil/spieler/234781,Left Winger,25.0,Cote d'Ivoire,2724.0,15.0, Lyon,"['Newcastle', 'Burnley', 'Everton', 'Nottingham', 'Chelsea']",True
478,"Serie A side Salernitana have joined the race to sign Finland midfielder Glen Kamara, 26, from Rangers",2022,90min,"['Salernitana', 'Rangers']",Glen Kamara,Scottish Premiership,https://www.transfermarkt.co.uk/glen-kamara/profil/spieler/242632,Defensive Midfield,26.0,Finland,1247.0,7.5,Rangers ,['Salernitana'],False
479,"Newcastle United are in talks with Chelsea about a loan deal for 26-year-old Germany striker Timo Werner, who has also been linked with former club RB Leipzig",2022,Sunday Mirror,"['Newcastle', 'Chelsea', 'RB Leipzig']",Timo Werner,Premier League,https://www.transfermarkt.co.uk/timo-werner/profil/spieler/170527,Centre-Forward,26.0,Germany,730.0,35.0,Chelsea ,"['Newcastle', 'RB Leipzig']",True
480,"Brighton will not hold any more talks with Manchester City over selling Spain left-back Marc Cucurella, 24, and will only accept an offer of at least PS50m",2022,Athletic - subscription required,"['Brighton', 'Manchester City']",Marc Cucurella,LaLiga,https://www.transfermarkt.co.uk/marc-cucurella/profil/spieler/284857,Left-Back,23.0,Spain,730.0,28.0,Getafe CF,"['Brighton', 'Manchester City']",True
481,"Manchester United will make one final attempt to persuade Barcelona and Netherlands midfielder Frenkie de Jong, 25, to move to Old Trafford this summer",2022,Mirror,"['Manchester United', 'Barcelona']",Frenkie de Jong,LaLiga,https://www.transfermarkt.co.uk/frenkie-de-jong/profil/spieler/326330,Central Midfield,25.0,Netherlands,1096.0,60.0, Barcelona,['Manchester United'],False
482,"Leicester City want more than PS50m if they are to sell England playmaker James Maddison to Newcastle United, who have had a PS40m bid for the 25-year-old rejected",2022,Times - subscription required,"['Leicester', 'Newcastle']",James Maddison,Premier League,https://www.transfermarkt.co.uk/james-maddison/profil/spieler/294057,Attacking Midfield,25.0,England,1461.0,50.0,Leicester City,['Newcastle'],False
483,Newcastle have made contact with Burnley about Maxwel Cornet but have yet to make an offer for the 25-year-old Ivory Coast winger,2022,90 Min,"['Newcastle', 'Burnley']",Maxwel Cornet,Ligue 1,https://www.transfermarkt.co.uk/maxwel-cornet/profil/spieler/234781,Left Winger,25.0,Cote d'Ivoire,2724.0,15.0, Lyon,"['Newcastle', 'Burnley']",True
484,Chelsea are close to a deal which would see 27-year-old Spain keeper Kepa Arrizabalaga join Italian side Napoli on loan for the season,2022,Mail on Sunday,"['Chelsea', 'Napoli']",Kepa Arrizabalaga,Premier League,https://www.transfermarkt.co.uk/kepa-arrizabalaga/profil/spieler/192279,Goalkeeper,27.0,Spain,1423.0,10.0,Chelsea ,['Napoli'],False
485,"Arsenal boss Mikel Arteta says he wants more additions to his squad this summer, with the Gunners understood to still retain an interest in Leicester City and Belgium midfielder Youri Tielemans, 25",2022,90 Min,"['Arsenal', 'Leicester']",Youri Tielemans,Premier League,https://www.transfermarkt.co.uk/youri-tielemans/profil/spieler/249565,Central Midfield,25.0,Belgium,1089.0,55.0,Leicester City,['Arsenal'],False
486,"France right-back Nordi Mukiele, 24, says he turned down a late approach from Chelsea before signing for Paris St-Germain",2022,"L'Equipe, via Metro","['Chelsea', 'Paris St-Germain']",Nordi Mukiele,Bundesliga,https://www.transfermarkt.co.uk/nordi-mukiele/profil/spieler/348026,Right-Back,24.0,France,1461.0,20.0,RB Leipzig,"['Chelsea', 'Paris St-Germain']",True
487,"Chelsea have had a PS6.7m (8m euros) bid for Italian midfielder Cesare Casadei rejected by Inter Milan, who want PS16.8m (20m euros) for the 19-year-old",2022,Gazzetta - in Italian,"['Chelsea', 'Inter Milan']",Cesare Casadei,Serie A,https://www.transfermarkt.co.uk/cesare-casadei/profil/spieler/622380,Central Midfield,19.0,Italy,,1.0,Inter Milan,['Chelsea'],False
488,"Juventus have added Belgium forward Dries Mertens to their list of possible forward signings, with the 35-year-old available on a free transfer after leaving Napoli",2022,"Gazzetta dello Sport, via Football Italia","['Juventus', 'Napoli']",Dries Mertens,Serie A,https://www.transfermarkt.co.uk/dries-mertens/profil/spieler/56416,Second Striker,35.0,Belgium,3287.0,4.0,SSC Napoli,['Juventus'],False
489,"Stoke City want to sign Manchester City's English striker Liam Delap on loan. The 19-year-old's father, Rory, played for the Potters",2022,Athletic - subscription required,"['Stoke', 'Manchester City']",Liam Delap,Premier League,https://www.transfermarkt.co.uk/liam-delap/profil/spieler/610849,Centre-Forward,19.0,England,,1.5,Manchester City,['Stoke'],True
490,Chelsea have offered 26-year-old Germany striker Timo Werner to Spanish side Real Madrid,2022,Marca,"['Chelsea', 'Real Madrid']",Timo Werner,Premier League,https://www.transfermarkt.co.uk/timo-werner/profil/spieler/170527,Centre-Forward,26.0,Germany,730.0,35.0,Chelsea ,['Real Madrid'],False
491,Liverpool forward erto Firmino has been linked with Juventus but the 30-year-old Brazil international says he wants to stay at Anfield,2022,Liverpool Echo,"['Liverpool', 'Juventus']",Roberto Firmino,Premier League,https://www.transfermarkt.co.uk/roberto-firmino/profil/spieler/131789,Centre-Forward,30.0,Brazil,2557.0,32.0,Liverpool ,['Juventus'],False
492,"Everton are continuing talks with Paris St-Germain as they look to finalise a move to bring Senegal midfielder Idrissa Gueye, 32, back to Goodison Park",2022,Times - subscription required,"['Everton', 'Paris St-Germain']",Idrissa Gueye,Ligue 1,https://www.transfermarkt.co.uk/idrissa-gueye/profil/spieler/126665,Central Midfield,32.0,Senegal,1067.0,12.0,Paris Saint-Germain,['Everton'],True
493,"Bayern Munich chief executive Oliver Kahn, who said Tottenham and England forward Harry Kane was ""a dream of the future"", says the German club are not planning to sign a new striker",2022,90 Min,"['Bayern Munich', 'Tottenham']",Harry Kane,Premier League,https://www.transfermarkt.co.uk/harry-kane/profil/spieler/132098,Centre-Forward,28.0,England,4199.0,90.0,Tottenham Hotspur,['Bayern Munich'],False
494,"Roma have made an offer to 28-year-old Italy striker Andrea Belotti, who is a free agent after leaving Torino in the summer",2022,Football Italia,"['Roma', 'Torino']",Andrea Belotti,Serie A,https://www.transfermarkt.co.uk/andrea-belotti/profil/spieler/167727,Centre-Forward,28.0,Italy,2509.0,20.0,Torino ,['Roma'],True
495,"Bournemouth boss Scott Parker says a deal for Middlesbrough's English midfielder Marcus Tavernier, 23, is now close",2022,Teesside Live,"['Bournemouth', 'Middlesbrough']",Marcus Tavernier,Championship,https://www.transfermarkt.co.uk/marcus-tavernier/profil/spieler/399434,Left Midfield,23.0,England,1461.0,4.5,Middlesbrough ,['Bournemouth'],True
496,"Leicester City have told Newcastle United they will need to pay PS60m if they want to sign England midfielder James Maddison, 25",2022,Football Insider,"['Leicester', 'Newcastle']",James Maddison,Premier League,https://www.transfermarkt.co.uk/james-maddison/profil/spieler/294057,Attacking Midfield,25.0,England,1461.0,50.0,Leicester City,['Newcastle'],False
497,"Leicester goalkeeper and captain Kasper Schmeichel, 35, is close to joining French side Nice and will have a medical this week, ending an 11-year stay with the Foxes",2022,Mail,"['Leicester', 'Nice']",Kasper Schmeichel,Premier League,https://www.transfermarkt.co.uk/kasper-schmeichel/profil/spieler/16911,Goalkeeper,35.0,Denmark,4018.0,4.0,Leicester City,['Nice'],True
498,"Manchester United have held talks with former Hull City and England midfielder Tom Huddlestone, 35, over a player-coach role with their Under-21s",2022,Telegraph,"['Manchester United', 'Hull']",Tom Huddlestone,Championship,https://www.transfermarkt.co.uk/tom-huddlestone/profil/spieler/13465,Defensive Midfield,35.0,England,318.0,0.25,Hull City,['Manchester United'],False
499,"Napoli are in talks with Chelsea over the loan signing of Spain goalkeeper Kepa Arrizabalaga, 27",2022,Sky Sports,"['Napoli', 'Chelsea']",Kepa Arrizabalaga,Premier League,https://www.transfermarkt.co.uk/kepa-arrizabalaga/profil/spieler/192279,Goalkeeper,27.0,Spain,1423.0,10.0,Chelsea ,['Napoli'],False
500,"Chelsea and Belgium striker Michy Batshuayi, 28, is open to a move to Everton this summer",2022,Talksport,"['Chelsea', 'Everton']",Michy Batshuayi,Sper Lig,https://www.transfermarkt.co.uk/michy-batshuayi/profil/spieler/179184,Centre-Forward,28.0,Belgium,317.0,10.0,Besiktas JK,"['Chelsea', 'Everton']",True
501,"United's Ivory Coast defender Eric Bailly, 28, has turned down a reunion with Jose Mourinho at Roma in favour of a move to Sevilla",2022,Sun,"['Roma', 'Sevilla']",Eric Bailly,Premier League,https://www.transfermarkt.co.uk/eric-bailly/profil/spieler/286384,Centre-Back,28.0,Cote d'Ivoire,2191.0,6.0,Manchester United,"['Roma', 'Sevilla']",False
502,"Arsenal and and Germany goalkeeper Bernd Leno, 30, is set to join Fulham after the clubs agreed on an PS8m deal and personal terms were settled",2022,Guardian,"['Arsenal', 'Fulham']",Bernd Leno,Premier League,https://www.transfermarkt.co.uk/bernd-leno/profil/spieler/72476,Goalkeeper,30.0,Germany,1461.0,9.0,Arsenal ,['Fulham'],True
503,"Arsenal striker Folarin Balogun, 21, is close to joining French side Reims on a season-long loan deal",2022,Mail,"['Arsenal', 'Reims']",Folarin Balogun,Championship,https://www.transfermarkt.co.uk/folarin-balogun/profil/spieler/503770,Centre-Forward,20.0,United States,170.0,4.0,Middlesbrough ,"['Arsenal', 'Reims']",True
504,"Former Manchester United and Arsenal forward Alexis Sanchez has terminated his Inter Milan contract to become a free agent, with Marseille interested in signing the 33-year-old Chilean",2022,Sky Sports,"['Manchester United', 'Arsenal', 'Inter Milan', 'Marseille']",Alexis Sanchez,Serie A,https://www.transfermarkt.co.uk/alexis-sanchez/profil/spieler/40433,Centre-Forward,33.0,Chile,668.0,3.5,Inter Milan,"['Manchester United', 'Arsenal', 'Marseille']",True
505,Barcelona remain in talks with Chelsea over Spain left-back Marcos Alonso and are confident of reaching an agreement to sign the 31-year-old,2022,90min,"['Barcelona', 'Chelsea']",Marcos Alonso,Premier League,https://www.transfermarkt.co.uk/marcos-alonso/profil/spieler/112515,Left-Back,31.0,Spain,2130.0,12.0,Chelsea ,['Barcelona'],True
506,"Crystal Palace are interested in re-signing English full-back Aaron Wan-Bissaka, 24, from Manchester United",2022,Sky Sports,"['Crystal Palace', 'Manchester United']",Aaron Wan-Bissaka,Premier League,https://www.transfermarkt.co.uk/aaron-wan-bissaka/profil/spieler/477758,Right-Back,24.0,England,1096.0,25.0,Manchester United,['Crystal Palace'],False
507,"Everton are set to beat West Ham to the signing of Belgium midfielder Amadou Onana, 20, from Lille",2022,Mirror,"['Everton', 'West Ham', 'Lille']",Amadou Onana,Ligue 1,https://www.transfermarkt.co.uk/amadou-onana/profil/spieler/485706,Defensive Midfield,20.0,Belgium,330.0,10.0,LOSC Lille,"['Everton', 'West Ham']",True
508,Tottenham are planning to complete a deal with Udinese for 19-year-old Italian defender Destiny Udogie next week,2022,Fabrizio Romano,"['Tottenham', 'Udinese']",Destiny Udogie,Serie A,https://www.transfermarkt.co.uk/destiny-udogie/profil/spieler/556385,Left-Back,19.0,Italy,-47.0,17.0,Udinese Calcio,['Tottenham'],True
509,"Barcelona and Netherlands midfielder Frenkie de Jong, 25, is prepared to remain with the Spanish club on a reduced salary despite interest from Chelsea and Manchester United",2022,Sport - in Spanish,"['Barcelona', 'Chelsea', 'Manchester United']",Frenkie de Jong,LaLiga,https://www.transfermarkt.co.uk/frenkie-de-jong/profil/spieler/326330,Central Midfield,25.0,Netherlands,1096.0,60.0, Barcelona,"['Chelsea', 'Manchester United']",False
510,Leeds are targeting a PS22m deal for Paris St-Germain's 20-year-old French forward Arnaud Kalimuendo,2022,Sun,"['Leeds', 'Paris St-Germain']",Arnaud Kalimuendo,Ligue 1,https://www.transfermarkt.co.uk/arnaud-kalimuendo/profil/spieler/585959,Centre-Forward,20.0,France,730.0,18.0,Paris Saint-Germain,['Leeds'],False
511,"Leeds owner Andrea Radrizzani has said Chelsea agreed a PS65m fee to sign Raphinha before ""Barcelona influences"" saw the Brazil winger, 25, choose to join the Spanish club instead",2022,The Athletic on YouTube,"['Leeds', 'Chelsea', 'Barcelona']",Raphinha,Premier League,https://www.transfermarkt.co.uk/raphinha/profil/spieler/411295,Right Winger,25.0,Brazil,634.0,45.0,Leeds United,"['Chelsea', 'Barcelona']",True
512,"Middlesbrough are finalising a deal to sign United States forward Matthew Hoppe, 21, from Mallorca",2022,90min,"['Middlesbrough', 'Mallorca']",Matthew Hoppe,LaLiga,https://www.transfermarkt.co.uk/matthew-hoppe/profil/spieler/678194,Centre-Forward,21.0,United States,304.0,1.0,RCD Mallorca,['Middlesbrough'],True
513,Manchester United have approached Bayern Munich about 26-year-old former Manchester City forward Leroy Sane,2022,Mirror,"['Manchester United', 'Bayern Munich', 'Manchester City']",Leroy Sane,Bundesliga,https://www.transfermarkt.co.uk/leroy-sane/profil/spieler/192565,Right Winger,26.0,Germany,716.0,60.0,Bayern Munich,"['Manchester United', 'Manchester City']",False
514,"Everton manager Frank Lampard wants 26-year-old Rennes and Guinea striker Serhou Guirassy, who is available for PS15m",2022,Sun,"['Everton', 'Rennes']",Serhou Guirassy,Ligue 1,https://www.transfermarkt.co.uk/serhou-guirassy/profil/spieler/270541,Centre-Forward,26.0,Guinea,673.0,10.0,Stade Rennais ,"['Everton', 'Rennes']",False
515,Bournemouth are set to sign 25-year-old Feyenoord and Argentina centre-back Marcos Senesi,2022,Fabrizio Romano,"['Bournemouth', 'Feyenoord']",Marcos Senesi,Eredivisie,https://www.transfermarkt.co.uk/marcos-senesi/profil/spieler/469781,Centre-Back,25.0,Argentina,1033.0,17.0,Feyenoord Rotterdam,['Bournemouth'],True
516,"French defender Dan-Axel Zagadou, 23 and a free agent after leaving Borussia Dortmund, is attracting interest from West Ham and Roma",2022,Sun,"['Dortmund', 'West Ham', 'Roma']",Dan-Axel Zagadou,Bundesliga,https://www.transfermarkt.co.uk/dan-axel-zagadou/profil/spieler/344598,Centre-Back,23.0,France,1826.0,9.0,Borussia Dortmund,"['West Ham', 'Roma']",False
517,"Chelsea owner Todd Boehly flew Spain defender Marc Cucurella, 24, to Mykonos in Greece to seal his transfer from Brighton",2022,Athletic - subscription,"['Chelsea', 'Brighton']",Marc Cucurella,LaLiga,https://www.transfermarkt.co.uk/marc-cucurella/profil/spieler/284857,Left-Back,23.0,Spain,730.0,28.0,Getafe CF,"['Chelsea', 'Brighton']",True
518,"Leicester and Southampton are on alert after England winger Callum Hudson-Odoi, 21, asked to leave Chelsea on loan before the transfer window shuts",2022,Guardian,"['Leicester', 'Southampton', 'Chelsea']",Callum Hudson-Odoi,Premier League,https://www.transfermarkt.co.uk/callum-hudson-odoi/profil/spieler/392768,Left Winger,21.0,England,1277.0,25.0,Chelsea ,"['Leicester', 'Southampton']",False
519,"Chelsea and Germany forward Timo Werner, 26, is close to a permanent return to RB Leipzig",2022,Mail,"['Chelsea', 'RB Leipzig']",Timo Werner,Premier League,https://www.transfermarkt.co.uk/timo-werner/profil/spieler/170527,Centre-Forward,26.0,Germany,730.0,35.0,Chelsea ,['RB Leipzig'],True
520,Manchester United have had a PS7.5m bid rejected by Bologna for 33-year-old Austria forward Marko Arnautovic,2022,Mail,"['Manchester United', 'Bologna']",Marko Arnautovic,Serie A,https://www.transfermarkt.co.uk/marko-arnautovic/profil/spieler/41384,Centre-Forward,33.0,Austria,334.0,6.0,Bologna  1909,['Manchester United'],False
521,Bayern Munich sporting director Hasan Salihamidzic has denied that Manchester United have made an enquiry for 26-year-old Germany winger Leroy Sane,2022,Manchester Evening News,"['Bayern Munich', 'Manchester United']",Leroy Sane,Bundesliga,https://www.transfermarkt.co.uk/leroy-sane/profil/spieler/192565,Right Winger,26.0,Germany,716.0,60.0,Bayern Munich,['Manchester United'],False
522,Marseille are close to signing 33-year-old Chile forward Alexis Sanchez after he terminated his contract with Inter Milan,2022,Fabrizio Romano,"['Marseille', 'Inter Milan']",Alexis Sanchez,Serie A,https://www.transfermarkt.co.uk/alexis-sanchez/profil/spieler/40433,Centre-Forward,33.0,Chile,668.0,3.5,Inter Milan,['Marseille'],True
523,Everton expect to beat West Ham to the signing of 29-year-old Wolves and England defender Conor Coady,2022,Mail,"['Everton', 'West Ham', 'Wolves']",Conor Coady,Premier League,https://www.transfermarkt.co.uk/conor-coady/profil/spieler/128901,Centre-Back,29.0,England,2555.0,25.0,Wolves,"['Everton', 'West Ham']",True
524,"Leicester City and Denmark defender Jannik Vestergaard, 30, has rejected a move to Fulham",2022,Football Insider,"['Leicester', 'Fulham']",Jannik Vestergaard,Premier League,https://www.transfermarkt.co.uk/jannik-vestergaard/profil/spieler/99331,Centre-Back,29.0,Denmark,322.0,13.0,Leicester City,['Fulham'],False
525,"Ivory Coast midfielder Ibrahim Sangare, 24, has extended his contract with PSV Eindhoven until 2027, despite interest from West Ham",2022,Sun,"['PSV Eindhoven', 'West Ham']",Ibrahim Sangare,Eredivisie,https://www.transfermarkt.co.uk/ibrahim-sangare/profil/spieler/375885,Defensive Midfield,24.0,Cote d'Ivoire,641.0,24.0,PSV Eindhoven,['West Ham'],False
526,"Feyenoord's Argentina defender Marcos Senesi, 25, is set for a PS13m move to Bournemouth",2022,Sun,"['Feyenoord', 'Bournemouth']",Marcos Senesi,Eredivisie,https://www.transfermarkt.co.uk/marcos-senesi/profil/spieler/469781,Centre-Back,25.0,Argentina,1033.0,17.0,Feyenoord Rotterdam,['Bournemouth'],True
527,"Manchester City have dismissed claims that they have accepted a bid from Barcelona for Portugal playmaker Bernardo Silva, 28",2022,Mail,"['Manchester City', 'Barcelona']",Bernardo Silva,Premier League,https://www.transfermarkt.co.uk/bernardo-silva/profil/spieler/241641,Attacking Midfield,27.0,Portugal,1826.0,80.0,Manchester City,['Barcelona'],False
528,"United have also been offered the chance to sign Spain international and former Chelsea striker Alvaro Morata, 29, who has a year left on his contract at Atletico Madrid",2022,ESPN,"['Chelsea', 'Atletico Madrid']",Alvaro Morata,Serie A,https://www.transfermarkt.co.uk/alvaro-morata/profil/spieler/128223,Centre-Forward,29.0,Spain,647.0,25.0,Juventus ,"['Chelsea', 'Atletico Madrid']",True
529,"PSV Eindhoven's the Netherlands forward Cody Gakpo, 23, is another forward interesting Manchester United but they would have to part with about PS35m for his signature",2022,Telegraph - subscription- required,"['PSV Eindhoven', 'Manchester United']",Cody Gakpo,Eredivisie,https://www.transfermarkt.co.uk/cody-gakpo/profil/spieler/434675,Left Winger,23.0,Netherlands,1461.0,30.0,PSV Eindhoven,['Manchester United'],False
530,"Arsenal are holding talks to sign AC Milan midfielder Sandro Tonali, 22, but the Serie A giants want PS46m for the Italy international",2022,Mail,"['Arsenal', 'AC Milan']",Sandro Tonali,Serie A,https://www.transfermarkt.co.uk/sandro-tonali/profil/spieler/397033,Defensive Midfield,22.0,Italy,358.0,50.0,AC Milan,['Arsenal'],False
531,"Chelsea could have a record-breaking PS85m transfer bid for Leicester City's French centre-back Wesley Fofana, 21, hijacked by Paris St-Germain",2022,TalkSport,"['Chelsea', 'Leicester', 'Paris St-Germain']",Wesley Fofana,Premier League,https://www.transfermarkt.co.uk/wesley-fofana/profil/spieler/475411,Centre-Back,21.0,France,637.0,40.0,Leicester City,"['Chelsea', 'Paris St-Germain']",True
532,"Thomas Tuchel's Chelsea are also preparing another approach for Italian midfielder Cesare Casadei, 19, with Inter Milan expected to accept a fee of around PS12m",2022,Evening Standard,"['Chelsea', 'Inter Milan']",Cesare Casadei,Serie A,https://www.transfermarkt.co.uk/cesare-casadei/profil/spieler/622380,Central Midfield,19.0,Italy,,1.0,Inter Milan,['Chelsea'],False
533,"Chelsea will also decide this week whether to pursue a deal to bring Barcelona's Gabon and former Arsenal striker Pierre-Emerick Aubameyang, 33, back to the Premier League",2022,FourFourTwo,"['Chelsea', 'Barcelona', 'Arsenal']",Pierre-Emerick Aubameyang,Premier League,https://www.transfermarkt.co.uk/pierre-emerick-aubameyang/profil/spieler/58864,Centre-Forward,33.0,Gabon,1612.0,15.0,Arsenal ,"['Chelsea', 'Barcelona']",True
534,"Barcelona's Spanish winger Alex Collado, 23, is a target for Scottish Premiership champions Celtic",2022,Daily Record,"['Barcelona', 'Celtic']",Alex Collado,LaLiga,https://www.transfermarkt.co.uk/alex-collado/profil/spieler/282722,Right Winger,23.0,Spain,175.0,4.0,Granada CF,"['Barcelona', 'Celtic']",True
535,"Leeds United have been given renewed hope they can seal the signing of Arnaud Kalimuendo, 20, with Paris St-Germain finally willing to put the French striker up for sale",2022,Yahoo Sports,"['Leeds', 'Paris St-Germain']",Arnaud Kalimuendo,Ligue 1,https://www.transfermarkt.co.uk/arnaud-kalimuendo/profil/spieler/585959,Centre-Forward,20.0,France,730.0,18.0,Paris Saint-Germain,['Leeds'],False
536,"Newcastle are set to submit an opening bid for Benfica's PS25m-rated Portuguese striker Goncalo Ramos, 21, who is also a target for Paris St-Germain",2022,Express,"['Newcastle', 'Benfica', 'Paris St-Germain']",Goncalo Ramos,Liga Portugal,https://www.transfermarkt.co.uk/goncalo-ramos/profil/spieler/550550,Centre-Forward,21.0,Portugal,638.0,14.0,SL Benfica,"['Newcastle', 'Paris St-Germain']",False
537,"Barcelona are offering Netherlands striker Memphis Depay, 28, to Serie A side Juventus as the Catalan club looks to offload players to ease their financial difficulties",2022,Goal,"['Barcelona', 'Juventus']",Memphis Depay,LaLiga,https://www.transfermarkt.co.uk/memphis-depay/profil/spieler/167850,Centre-Forward,28.0,Netherlands,365.0,35.0, Barcelona,['Juventus'],False
538,"Aston Villa's pursuit of PS30m-rated striker Raul de Tomas, 27, has been given a boost after Espanyol's chairman said the Spaniard might leave the club, although Everton, Newcastle and West Ham are also interested",2022,Birmingham Mail,"['Aston Villa', 'Espanyol', 'Everton', 'Newcastle', 'West Ham']",Raul de Tomas,LaLiga,https://www.transfermarkt.co.uk/raul-de-tomas/profil/spieler/162038,Centre-Forward,27.0,Spain,904.0,25.0,RCD Espanyol Barcelona,"['Aston Villa', 'Everton', 'Newcastle', 'West Ham']",False
539,"Burnley have seen a PS2.5m bid for Cardiff City's Welsh striker Isaak Davies, 20, rejected by their Championship rivals",2022,Wales Online,"['Burnley', 'Cardiff']",Isaak Davies,Championship,https://www.transfermarkt.co.uk/isaak-davies/profil/spieler/547039,Second Striker,20.0,Wales,365.0,0.4,Cardiff City,['Burnley'],False
