,Rumour,Year,Outlet,Clubs,Player,League,Player Link,Position,Age,Country,Join,Market Value,Club,Interested_clubs,Outcome
71,"Benfica's Uruguay forward Darwin Nunez, 22, is hesitant to join Manchester United because they are not in the Champions League next season",2022,Mirror,"['Benfica', 'Manchester United']",Darwin Nunez,Liga Portugal,https://www.transfermarkt.co.uk/darwin-nunez/profil/spieler/546543,Centre-Forward,23.0,Uruguay,665.0,55.0,SL Benfica,['Manchester United'],False
72,"Manchester United have made an initial offer of 60m euros (PS51m) - plus 20m euros (PS17m) in add-ons - for Barcelona's 25-year-old Netherlands midfielder Frenkie de Jong, who has been contacted by manager Erik ten Hag",2022,Marca - in Spanish,"['Manchester United', 'Barcelona']",Frenkie de Jong,LaLiga,https://www.transfermarkt.co.uk/frenkie-de-jong/profil/spieler/326330,Central Midfield,25.0,Netherlands,1096.0,60.0, Barcelona,['Manchester United'],False
73,"Wales striker Gareth Bale, 32, could sign for Madrid-based Getafe because of a desire not to uproot his family following his Real Madrid exit",2022,Mail,"['Getafe', 'Real Madrid']",Gareth Bale,LaLiga,https://www.transfermarkt.co.uk/gareth-bale/profil/spieler/39381,Right Winger,32.0,Wales,3225.0,3.0,Real Madrid,['Getafe'],False
74,"Manchester City's Brazil forward Gabriel Jesus has been offered to Tottenham in a blow to their north London rivals Arsenal, who have also been linked with the 25-year-old",2022,Times - subscription required,"['Manchester City', 'Tottenham', 'Arsenal']",Gabriel Jesus,Premier League,https://www.transfermarkt.co.uk/gabriel-jesus/profil/spieler/363205,Centre-Forward,25.0,Brazil,2007.0,50.0,Manchester City,"['Tottenham', 'Arsenal']",True
75,"Former Manchester United manager Louis van Gaal has warned Ajax and Netherlands defender Jurrien Timber, 20, against a move to Old Trafford this summer",2022,TalkSport,"['Manchester United', 'Ajax']",Jurrien Timber,Eredivisie,https://www.transfermarkt.co.uk/jurrien-timber/profil/spieler/420243,Centre-Back,21.0,Netherlands,651.0,35.0,Ajax Amsterdam,['Manchester United'],False
76,"Tottenham have had their attempt to sign Manchester United's England striker Marcus Rashford, 24, rejected",2022,Times - subscription required,"['Tottenham', 'Manchester United']",Marcus Rashford,Premier League,https://www.transfermarkt.co.uk/marcus-rashford/profil/spieler/258923,Left Winger,24.0,England,2373.0,60.0,Manchester United,['Tottenham'],False
77,Juventus have cooled their interest in former Manchester United forward Jesse Lingard after initially expressing an interest in signing the 29-year-old England international on a free transfer,2022,Goal,"['Juventus', 'Manchester United']",Jesse Lingard,Premier League,https://www.transfermarkt.co.uk/jesse-lingard/profil/spieler/141660,Attacking Midfield,29.0,England,2922.0,18.0,Manchester United,['Juventus'],False
78,"PSV Eindhoven midfielder Ibrahim Sangare has set his heart on a move to the Premier League, with Liverpool, Chelsea, Manchester United and Newcastle monitoring the 24-year-old Ivory Coast international",2022,Sky Sports,"['PSV Eindhoven', 'Liverpool', 'Chelsea', 'Manchester United', 'Newcastle']",Ibrahim Sangare,Eredivisie,https://www.transfermarkt.co.uk/ibrahim-sangare/profil/spieler/375885,Defensive Midfield,24.0,Cote d'Ivoire,641.0,24.0,PSV Eindhoven,"['Liverpool', 'Chelsea', 'Manchester United', 'Newcastle']",False
79,Manchester United and Chelsea are interested in Leicester's 21-year-old France defender Wesley Fofana,2022,RMC Sport - in French,"['Manchester United', 'Chelsea', 'Leicester']",Wesley Fofana,Premier League,https://www.transfermarkt.co.uk/wesley-fofana/profil/spieler/475411,Centre-Back,21.0,France,637.0,40.0,Leicester City,"['Manchester United', 'Chelsea']",True
80,"Inter Milan will keep hold of Italy defender Alessandro Bastoni, 23, in a blow to Manchester United and Tottenham",2022,Mirror,"['Inter Milan', 'Manchester United', 'Tottenham']",Alessandro Bastoni,Serie A,https://www.transfermarkt.co.uk/alessandro-bastoni/profil/spieler/315853,Centre-Back,23.0,Italy,1766.0,60.0,Inter Milan,"['Manchester United', 'Tottenham']",False
81,Arsenal have been offered the chance to sign 26-year-old Switzerland defender Manuel Akanji from Borussia Dortmund,2022,Sun,"['Arsenal', 'Dortmund']",Manuel Akanji,Bundesliga,https://www.transfermarkt.co.uk/manuel-akanji/profil/spieler/284730,Centre-Back,26.0,Switzerland,1628.0,30.0,Borussia Dortmund,['Arsenal'],False
82,Liverpool have reached an agreement on personal terms with Benfica's 22-year-old Uruguay striker Darwin Nunez,2022,The Athletic,"['Liverpool', 'Benfica']",Darwin Nunez,Liga Portugal,https://www.transfermarkt.co.uk/darwin-nunez/profil/spieler/546543,Centre-Forward,23.0,Uruguay,665.0,55.0,SL Benfica,['Liverpool'],True
83,"Liverpool expect Bayern Munich to meet their valuation of more than PS40m for 30-year-old Senegal forward Sadio Mane, which will help supply the funds to sign Nunez for about PS60m",2022,Telegraph - subscription required,"['Liverpool', 'Bayern Munich']",Sadio Mane,Premier League,https://www.transfermarkt.co.uk/sadio-mane/profil/spieler/200512,Left Winger,30.0,Senegal,2191.0,70.0,Liverpool ,['Bayern Munich'],True
84,"Manchester United are contemplating a move for Liverpool's former England midfielder Alex Oxlade-Chamberlain, 28",2022,TalkSport,"['Manchester United', 'Liverpool']",Alex Oxlade-Chamberlain,Premier League,https://www.transfermarkt.co.uk/alex-oxlade-chamberlain/profil/spieler/143424,Central Midfield,28.0,England,1765.0,16.0,Liverpool ,['Manchester United'],False
85,"Europe's top clubs believe Raheem Sterling, 27, is ready to leave Manchester City this summer, with Chelsea among those weighing up a bid",2022,Telegraph - subscription required,"['Manchester City', 'Chelsea']",Raheem Sterling,Premier League,https://www.transfermarkt.co.uk/raheem-sterling/profil/spieler/134425,Left Winger,27.0,England,2544.0,70.0,Manchester City,['Chelsea'],True
86,"Manchester City and Real Madrid are watching developments with England defender Reece James, 22, who has yet to be given an improved contract at Chelsea. James earns around PS70,000 a week and has three years left on his current deal at Stamford Bridge",2022,Mail,"['Manchester City', 'Real Madrid', 'Chelsea']",Reece James,Premier League,https://www.transfermarkt.co.uk/reece-james/profil/spieler/472423,Right-Back,22.0,England,1096.0,60.0,Chelsea ,"['Manchester City', 'Real Madrid']",False
87,Brazil winger Antony's representatives are in Europe trying to agree a deal with Manchester United. The 22-year-old played under Reds boss Erik ten Hag at Ajax and is valued at around 60m euros (PS51m) by the Dutch club,2022,Goal Brazil in Portuguese,"['Manchester United', 'Ajax']",Antony,Eredivisie,https://www.transfermarkt.co.uk/antony/profil/spieler/602105,Right Winger,22.0,Brazil,730.0,35.0,Ajax Amsterdam,['Manchester United'],True
88,"Bayer Leverkusen have told Newcastle they plan to keep France winger Moussa Diaby, 22, beyond this summer",2022,Express,"['Bayer Leverkusen', 'Newcastle']",Moussa Diaby,Bundesliga,https://www.transfermarkt.co.uk/moussa-diaby/profil/spieler/395516,Right Winger,22.0,France,1096.0,60.0,Bayer 04 Leverkusen,['Newcastle'],False
89,"Manchester City's 31-year-old Germany midfielder Ilkay Gundogan, whose contract runs until 2023, is wanted by Barcelona and Juventus",2022,Bild - in German,"['Manchester City', 'Barcelona', 'Juventus']",Ilkay Gundogan,Premier League,https://www.transfermarkt.co.uk/ilkay-gundogan/profil/spieler/53622,Central Midfield,31.0,Germany,2191.0,25.0,Manchester City,"['Barcelona', 'Juventus']",False
90,"Oleksandr Zinchenko is open to leaving Manchester City this summer but any interested clubs, which include Wolves, Arsenal, Everton, Leicester and West Ham, would have to guarantee the 25-year-old playing time in midfield, where the left-sided player plays for Ukraine",2022,90min,"['Manchester City', 'Wolves', 'Arsenal', 'Everton', 'Leicester', 'West Ham']",Oleksandr Zinchenko,Premier League,https://www.transfermarkt.co.uk/oleksandr-zinchenko/profil/spieler/203853,Left-Back,25.0,Ukraine,2188.0,25.0,Manchester City,"['Wolves', 'Arsenal', 'Everton', 'Leicester', 'West Ham']",True
91,"Chelsea and Tottenham have joined Manchester City in monitoring the situation of Spain left-back Marc Cucurella, 23, at Brighton",2022,Goal,"['Chelsea', 'Tottenham', 'Manchester City', 'Brighton']",Marc Cucurella,LaLiga,https://www.transfermarkt.co.uk/marc-cucurella/profil/spieler/284857,Left-Back,23.0,Spain,730.0,28.0,Getafe CF,"['Chelsea', 'Tottenham', 'Manchester City', 'Brighton']",True
92,"Wolves have placed a PS25m valuation on English midfielder Morgan Gibbs-White, with the 22-year-old having been linked with Nottingham Forest and Southampton after last season's loan spell with Sheffield United",2022,Football Insider,"['Wolves', 'Nottingham', 'Southampton', 'Sheffield']",Morgan Gibbs-White,Premier League,https://www.transfermarkt.co.uk/morgan-gibbs-white/profil/spieler/429014,Attacking Midfield,22.0,England,2007.0,11.0,Wolves,"['Nottingham', 'Southampton', 'Sheffield']",True
93,"Leeds United and Aston Villa have opened talks to sign 18-year-old English forward Sonny Perkins, who has made three first-team appearances for West Ham",2022,Guardian,"['Leeds', 'Aston Villa', 'West Ham']",Sonny Perkins,Premier League,https://www.transfermarkt.co.uk/sonny-perkins/profil/spieler/670877,Centre-Forward,18.0,England,,1.2,West Ham United,"['Leeds', 'Aston Villa']",False
94,Fulham are close to signing Albania goalkeeper Thomas Strakosha on a free transfer. The 27-year-old's contract at Italian side Lazio expires this summer,2022,Sun,"['Fulham', 'Lazio']",Thomas Strakosha,Serie A,https://www.transfermarkt.co.uk/thomas-strakosha/profil/spieler/222209,Goalkeeper,27.0,Albania,3438.0,7.0,SS Lazio,['Fulham'],False
95,"Middlesbrough have spoken to Southampton about a loan deal for English striker Adam Armstrong, 25",2022,TeamTalk,"['Middlesbrough', 'Southampton']",Adam Armstrong,Premier League,https://www.transfermarkt.co.uk/adam-armstrong/profil/spieler/250426,Centre-Forward,25.0,England,325.0,15.0,Southampton ,['Middlesbrough'],False
96,"Arsenal are willing to pay more than PS42m for Lazio's Serbia midfielder Sergej Milinkovic-Savic, although Newcastle could also bid for the 27-year-old",2022,Corriere dello Sport - in Italian,"['Arsenal', 'Lazio', 'Newcastle']",Sergej Milinkovic-Savic,Serie A,https://www.transfermarkt.co.uk/sergej-milinkovi%C4%87-savi%C4%87/profil/spieler/266302,Central Midfield,27.0,Serbia,2521.0,70.0,SS Lazio,"['Arsenal', 'Newcastle']",False
97,"Paul Pogba has not completed a free transfer from Manchester United to Juventus yet as the France midfielder, 29, is waiting to see if Zinedine Zidane is appointed Paris St-Germain coach",2022,RMC Sport - in French,"['Manchester United', 'Juventus', 'Paris St-Germain']",Paul Pogba,Premier League,https://www.transfermarkt.co.uk/paul-pogba/profil/spieler/122153,Central Midfield,29.0,France,2152.0,48.0,Manchester United,"['Juventus', 'Paris St-Germain']",True
98,"Sevilla say France centre-back Jules Kounde is looking to leave the club this summer, with Chelsea expected to sign the 23-year-old",2022,Sport Witness,"['Sevilla', 'Chelsea']",Jules Kounde,LaLiga,https://www.transfermarkt.co.uk/jules-kounde/profil/spieler/411975,Centre-Back,23.0,France,1094.0,60.0,Sevilla ,['Chelsea'],False
99,"AC Milan are the latest club to show interest in signing Manchester City's Brazil forward Gabriel Jesus, 25",2022,90min,"['AC Milan', 'Manchester City']",Gabriel Jesus,Premier League,https://www.transfermarkt.co.uk/gabriel-jesus/profil/spieler/363205,Centre-Forward,25.0,Brazil,2007.0,50.0,Manchester City,['AC Milan'],False
100,Arsenal are set to announce the signing of 19-year-old Brazilian forward Marquinhos from Sao Paulo on a five-year contract for about PS3m,2022,Guardian,"['Arsenal', 'Sao Paulo']",Marquinhos,Ligue 1,https://www.transfermarkt.co.uk/marquinhos/profil/spieler/181767,Centre-Back,28.0,Brazil,3269.0,70.0,Paris Saint-Germain,"['Arsenal', 'Sao Paulo']",True
101,"Meanwhile, Arsenal are among the clubs considering a move for Leeds United's Raphinha this summer, with Barcelona, Manchester United, Chelsea and Liverpool having also been linked with the Brazil winger, 25",2022,Telegraph - subscription required,"['Arsenal', 'Leeds', 'Barcelona', 'Manchester United', 'Chelsea', 'Liverpool']",Raphinha,Premier League,https://www.transfermarkt.co.uk/raphinha/profil/spieler/411295,Right Winger,25.0,Brazil,634.0,45.0,Leeds United,"['Arsenal', 'Barcelona', 'Manchester United', 'Chelsea', 'Liverpool']",True
102,"Liverpool have yet to agree a fee for Benfica's Darwin Nunez, but the 22-year-old Uruguay striker has already told friends and family he is moving to Anfield",2022,Liverpool Echo,"['Liverpool', 'Benfica']",Darwin Nunez,Liga Portugal,https://www.transfermarkt.co.uk/darwin-nunez/profil/spieler/546543,Centre-Forward,23.0,Uruguay,665.0,55.0,SL Benfica,['Liverpool'],True
103,"New Chelsea owner Todd Boehly's relationship with Jay-Z's Roc Nation Sports could be key to the future of Romelu Lukaku, 29, and the Belgium striker's hopes of a return to Inter Milan",2022,Telegraph - subscription required,"['Chelsea', 'Inter Milan']",Romelu Lukaku,Premier League,https://www.transfermarkt.co.uk/romelu-lukaku/profil/spieler/96341,Centre-Forward,29.0,Belgium,323.0,70.0,Chelsea ,['Inter Milan'],True
104,AC Milan have backed away from signing Dutch defender Sven Botman from Lille after Newcastle increased their offer for the 22-year-old,2022,"Sky Sport Italia, via Football Italia","['AC Milan', 'Lille', 'Newcastle']",Sven Botman,Ligue 1,https://www.transfermarkt.co.uk/sven-botman/profil/spieler/361093,Centre-Back,22.0,Netherlands,700.0,30.0,LOSC Lille,"['AC Milan', 'Newcastle']",True
105,"Brentford have made an official approach to Italian side Bologna for 20-year-old Scotland defender Aaron Hickey, who is also attracting interest from Napoli, Arsenal, Newcastle and Aston Villa",2022,Mail,"['Brentford', 'Bologna', 'Napoli', 'Arsenal', 'Newcastle', 'Aston Villa']",Aaron Hickey,Serie A,https://www.transfermarkt.co.uk/aaron-hickey/profil/spieler/591949,Right-Back,20.0,Scotland,645.0,18.0,Bologna  1909,"['Brentford', 'Napoli', 'Arsenal', 'Newcastle', 'Aston Villa']",True
106,"Hellas Verona are set to take up their purchase option on former loanee Giovanni Simeone and then sell the Argentina striker, with West Ham and Arsenal interested in the 26-year-old, who is currently at Cagliari",2022,AS - in Spanish,"['Hellas Verona', 'West Ham', 'Arsenal']",Giovanni Simeone,Serie A,https://www.transfermarkt.co.uk/giovanni-simeone/profil/spieler/282388,Centre-Forward,26.0,Argentina,668.0,17.0,Cagliari Calcio,"['Hellas Verona', 'West Ham', 'Arsenal']",True
107,"Newly promoted Nottingham Forest are targeting Arsenal's England midfielder Ainsley Maitland-Niles, 24, who was on loan with Roma last season",2022,Mirror,"['Nottingham', 'Arsenal', 'Roma']",Ainsley Maitland-Niles,Premier League,https://www.transfermarkt.co.uk/ainsley-maitland-niles/profil/spieler/285845,Right Midfield,24.0,England,1826.0,10.0,Arsenal ,"['Nottingham', 'Roma']",True
108,"Tottenham have agreed a deal to buy Middlesbrough's Djed Spence, who was on loan at NottinghamForest last season, with the fee for the 21-year-old English right-back about PS20m",2022,Guardian,"['Tottenham', 'Middlesbrough']",Djed Spence,Championship,https://www.transfermarkt.co.uk/djed-spence/profil/spieler/483348,Right-Back,21.0,England,912.0,8.0,Middlesbrough ,['Tottenham'],True
109,"Fulham are close to finalising a deal to sign Lazio's Albania goalkeeper Thomas Strakosha, 27",2022,90min,"['Fulham', 'Lazio']",Thomas Strakosha,Serie A,https://www.transfermarkt.co.uk/thomas-strakosha/profil/spieler/222209,Goalkeeper,27.0,Albania,3438.0,7.0,SS Lazio,['Fulham'],False
110,Wales forward Gareth Bale says he will not be joining Getafe after leaving Real Madrid this summer and the 32-year-old will make a decision on his future after his country's latest Nations League fixtures,2022,The Athletic,"['Getafe', 'Real Madrid']",Gareth Bale,LaLiga,https://www.transfermarkt.co.uk/gareth-bale/profil/spieler/39381,Right Winger,32.0,Wales,3225.0,3.0,Real Madrid,['Getafe'],False
111,"Juventus are confident of signing Paul Pogba on a free transfer from Manchester United, with the 29-year-old France midfielder to agree a four-year contract",2022,"Fabrizio Romano, Twitter","['Juventus', 'Manchester United']",Paul Pogba,Premier League,https://www.transfermarkt.co.uk/paul-pogba/profil/spieler/122153,Central Midfield,29.0,France,2152.0,48.0,Manchester United,['Juventus'],True
112,"Tottenham's Steven Bergwijn says he has interest from a number of clubs as the Netherlands winger, 24, looks to leave, with Ajax in talks over a summer move",2022,90min,"['Tottenham', 'Ajax']",Steven Bergwijn,Premier League,https://www.transfermarkt.co.uk/steven-bergwijn/profil/spieler/284165,Left Winger,24.0,Netherlands,884.0,18.0,Tottenham Hotspur,['Ajax'],True
113,"English right-back Jonjoe Kenny, 25, has committed to joining Hertha Berlin on a free transfer from Everton",2022,Bild - in German,"['Hertha', 'Everton']",Jonjoe Kenny,Premier League,https://www.transfermarkt.co.uk/jonjoe-kenny/profil/spieler/258883,Right-Back,25.0,England,1826.0,4.0,Everton ,['Hertha'],True
114,"Denmark midfielder Christian Eriksen, 30, has decided to pursue a new challenge and is preparing to leave Brentford, amid interest from former club Tottenham Hotspur and Manchester United",2022,Express,"['Brentford', 'Tottenham', 'Manchester United']",Christian Eriksen,Premier League,https://www.transfermarkt.co.uk/christian-eriksen/profil/spieler/69633,Central Midfield,30.0,Denmark,151.0,20.0,Brentford ,"['Tottenham', 'Manchester United']",True
115,"Newcastle are hopeful of challenging Juventus and AC Milan for the signing of Italian midfielder Nicolo Zaniolo, 22, from Roma",2022,Gazetta dello Sport - in Italian,"['Newcastle', 'Juventus', 'AC Milan', 'Roma']",Nicolo Zaniolo,Serie A,https://www.transfermarkt.co.uk/nicolo-zaniolo/profil/spieler/392085,Attacking Midfield,22.0,Italy,1461.0,33.0,AS Roma,"['Newcastle', 'Juventus', 'AC Milan']",False
116,"Inter Milan are set to sign Paulo Dybala on a free transfer from Juventus, with the Argentine striker, 28, arriving on a three-year deal",2022,Goal,"['Inter Milan', 'Juventus']",Paulo Dybala,Serie A,https://www.transfermarkt.co.uk/paulo-dybala/profil/spieler/206050,Second Striker,28.0,Argentina,2557.0,35.0,Juventus ,['Inter Milan'],False
117,"Paris St-Germain have had a bid of 40m euros (PS34.1m) turned down for Slovakia defender Milan Skriniar, but Inter Milan may accept 60m euros (PS51.2m) for the 27-year-old",2022,Gazzetta dello Sport - in Italian,"['Paris St-Germain', 'Inter Milan']",Milan Skriniar,Serie A,https://www.transfermarkt.co.uk/milan-skriniar/profil/spieler/204069,Centre-Back,27.0,Slovakia,1820.0,65.0,Inter Milan,['Paris St-Germain'],False
118,"Manchester City will push to sign a midfielder, with Leeds United and England international Kalvin Phillips, 26, the preferred target",2022,"Times, subscription required","['Manchester City', 'Leeds']",Kalvin Phillips,Premier League,https://www.transfermarkt.co.uk/kalvin-phillips/profil/spieler/351749,Defensive Midfield,26.0,England,2557.0,50.0,Leeds United,['Manchester City'],True
119,"Manchester United have opened talks with Barcelona for Netherlands midfielder Frenkie de Jong, 25, but will not pay over the odds with the Spanish club wanting 100m euros (PS85.7m)",2022,Manchester Evening News,"['Manchester United', 'Barcelona']",Frenkie de Jong,LaLiga,https://www.transfermarkt.co.uk/frenkie-de-jong/profil/spieler/326330,Central Midfield,25.0,Netherlands,1096.0,60.0, Barcelona,['Manchester United'],False
120,"RB Leipzig have set a price of PS100m for France er Christopher Nkunku, with Manchester United, Arsenal and Paris St-Germain interested in the 24-year-old",2022,Independent,"['RB Leipzig', 'Manchester United', 'Arsenal', 'Paris St-Germain']",Christopher Nkunku,Bundesliga,https://www.transfermarkt.co.uk/christopher-nkunku/profil/spieler/344381,Second Striker,24.0,France,1079.0,80.0,RB Leipzig,"['Manchester United', 'Arsenal', 'Paris St-Germain']",False
121,Newcastle United are prepared to move to another target after Lille raised their asking price for 22-year-old Netherlands defender Sven Botman from PS30m to PS36m,2022,"Telegraph, subscription required","['Newcastle', 'Lille']",Sven Botman,Ligue 1,https://www.transfermarkt.co.uk/sven-botman/profil/spieler/361093,Centre-Back,22.0,Netherlands,700.0,30.0,LOSC Lille,['Newcastle'],True
122,"Fulham are interested in a deal for Arsenal and Germany goalkeeper Bernd Leno, 30, as they prepare for life in the Premier League",2022,Evening Standard,"['Fulham', 'Arsenal']",Bernd Leno,Premier League,https://www.transfermarkt.co.uk/bernd-leno/profil/spieler/72476,Goalkeeper,30.0,Germany,1461.0,9.0,Arsenal ,['Fulham'],True
123,"Brighton are targeting Porto and Nigeria left-back Zaidu Sanusi, 25, in a move which could pave the way for the Seagulls' Spain international Marc Cucurella, 23, to join Manchester City",2022,Star,"['Brighton', 'Porto', 'Manchester City']",Marc Cucurella,LaLiga,https://www.transfermarkt.co.uk/marc-cucurella/profil/spieler/284857,Left-Back,23.0,Spain,730.0,28.0,Getafe CF,"['Brighton', 'Porto', 'Manchester City']",True
124,"Leeds United are close to finalising a deal with Bayern Munich for Spanish midfielder Marc Roca, 25",2022,90min,"['Leeds', 'Bayern Munich']",Marc Roca,Bundesliga,https://www.transfermarkt.co.uk/marc-roca/profil/spieler/336869,Defensive Midfield,25.0,Spain,635.0,7.0,Bayern Munich,['Leeds'],True
125,Fulham are leading Nottingham Forest in the race to sign 21-year-old Wales right-back Neco Williams from Liverpool,2022,Football League World,"['Fulham', 'Nottingham', 'Liverpool']",Neco Williams,Premier League,https://www.transfermarkt.co.uk/neco-williams/profil/spieler/503680,Right-Back,21.0,Wales,912.0,8.0,Liverpool ,"['Fulham', 'Nottingham']",True
126,"Preston North End are in advanced talks to sign Watford striker Andre Gray, with the 30-year-old Jamaica international available on a free transfer",2022,Football Insider,"['Preston', 'Watford']",Andre Gray,Premier League,https://www.transfermarkt.co.uk/andre-gray/profil/spieler/120565,Centre-Forward,31.0,Jamaica,1787.0,2.0,Watford ,['Preston'],False
127,"Manchester United have made an offer to sign Denmark midfielder Christian Eriksen, 30, as his Brentford contract expires at the end of this month",2022,The Athletic,"['Manchester United', 'Brentford']",Christian Eriksen,Premier League,https://www.transfermarkt.co.uk/christian-eriksen/profil/spieler/69633,Central Midfield,30.0,Denmark,151.0,20.0,Brentford ,['Manchester United'],True
128,"Manchester United's interest in Eriksen would not rule out a move for their number one target Frenkie de Jong, 25, as talks continue with the Dutch midfielder's club Barcelona",2022,Mail,"['Manchester United', 'Barcelona']",Frenkie de Jong,LaLiga,https://www.transfermarkt.co.uk/frenkie-de-jong/profil/spieler/326330,Central Midfield,25.0,Netherlands,1096.0,60.0, Barcelona,['Manchester United'],False
129,"Juventus are close to agreeing a contract for France and Manchester United midfielder Paul Pogba, 29, who will leave Old Trafford when his contract expires this month",2022,Fabrizio Romano,"['Juventus', 'Manchester United']",Paul Pogba,Premier League,https://www.transfermarkt.co.uk/paul-pogba/profil/spieler/122153,Central Midfield,29.0,France,2152.0,48.0,Manchester United,['Juventus'],True
130,Manchester City could raise more than PS200m in player sales this summer as the club look to land Leeds United's 26-year-old England midfielder Kalvin Phillips,2022,Telegraph - subscription required,"['Manchester City', 'Leeds']",Kalvin Phillips,Premier League,https://www.transfermarkt.co.uk/kalvin-phillips/profil/spieler/351749,Defensive Midfield,26.0,England,2557.0,50.0,Leeds United,['Manchester City'],True
131,"Inter Milan are pushing to sign Romelu Lukaku, 29, from Chelsea with the Belgium striker prepared to take a wage cut in order to return to the Serie A club",2022,Fabrizio Romano,"['Inter Milan', 'Chelsea']",Romelu Lukaku,Premier League,https://www.transfermarkt.co.uk/romelu-lukaku/profil/spieler/96341,Centre-Forward,29.0,Belgium,323.0,70.0,Chelsea ,['Inter Milan'],True
132,"Leeds United have reached a verbal agreement to sign Spanish midfielder Marc Roca, 25, from Bayern Munich in a four-year deal worth 12m euros plus add-ons",2022,Fabrizio Romano,"['Leeds', 'Bayern Munich']",Marc Roca,Bundesliga,https://www.transfermarkt.co.uk/marc-roca/profil/spieler/336869,Defensive Midfield,25.0,Spain,635.0,7.0,Bayern Munich,['Leeds'],True
133,Arsenal-linked Victor Osimhen says he will decide on his future later in the summer after the 23-year-old Nigeria and Napoli forward admitted he was aware of interest from clubs in England and Spain,2022,Standard,"['Arsenal', 'Napoli']",Victor Osimhen,Serie A,https://www.transfermarkt.co.uk/victor-osimhen/profil/spieler/401923,Centre-Forward,23.0,Nigeria,668.0,65.0,SSC Napoli,['Arsenal'],False
134,"Manchester City's Japan defender Ko Itakura, 25, is wanted by Borussia Monchengladbach",2022,"Lyall Thomas, via Mail","['Manchester City', 'Borussia Monchengladbach']",Ko Itakura,,,,,,,,,"['Manchester City', 'Borussia Monchengladbach']",True
135,"Chelsea are considering a deal for Lazio's Albania international goalkeeper Thomas Strakosha, 27, if Spain keeper Kepa, 27, leaves the club this summer",2022,Fabrizio Romano,"['Chelsea', 'Lazio']",Thomas Strakosha,Serie A,https://www.transfermarkt.co.uk/thomas-strakosha/profil/spieler/222209,Goalkeeper,27.0,Albania,3438.0,7.0,SS Lazio,['Chelsea'],False
